objectID,title,created_at,points,num_comments,url
21495397,Fritz AI is the machine learning platform for iOS and Android,2019-11-09T23:58:56.000Z,3,0,https://www.fritz.ai/
21495395,Ask HN: What is a good book to learn about the components of modern APIs?,2019-11-09T23:58:26.000Z,4,1,
21495392,Python Overtakes Java on GitHub,2019-11-09T23:58:09.000Z,3,0,https://www.zdnet.com/article/programming-languages-python-overtakes-java-on-github-as-google-dart-use-soars/
21495386,Phase 1 Trial of Genetically Modified Autologous Cell Therapy for HIV,2019-11-09T23:56:39.000Z,2,0,https://www.americangene.com/press-releases/ind-application-submission-to-fda-for-phase-1-trial-of-genetically-modified-autologous-cell-therapy-for-hiv-announced-by-american-gene-technologies/
21495377,Hacktuite (The True Decentralized Static Microblog),2019-11-09T23:54:45.000Z,1,0,
21495369,Subjectivity in writing and evaluating writing (2012),2019-11-09T23:52:49.000Z,2,0,https://jakeseliger.com/2012/12/20/subjectivity-in-writing-and-evaluating-writing
21495363,How Toilet Roll Art Taught Me About Levity as a Workplace Superpower,2019-11-09T23:51:48.000Z,1,0,https://spin.atomicobject.com/2019/11/09/toilet-paper-roll-art/#.XcdREWtEEQM.hackernews
21495356,Chancla.io: Hello World Tutorial (Cloud-Native IDE),2019-11-09T23:50:09.000Z,1,0,https://www.chancla.io/hello-world-tutorial.html
21495351,1k Feeder Ship to Test Carbon-Neutral Synthetic Natural Gas,2019-11-09T23:48:35.000Z,1,0,https://gcaptain.com/1000-feeder-ship-to-test-carbon-neutral-synthetic-natural-gas/
21495338,Rust 2020: GUI and Community,2019-11-09T23:46:07.000Z,142,35,https://raphlinus.github.io/rust/druid/2019/10/31/rust-2020.html
21495328,First ever signing of a Bitcoin message over the cellular infrastructure,2019-11-09T23:43:47.000Z,2,0,https://medium.com/new-capital/fix-network-achieves-significant-milestone-by-the-first-ever-signing-of-a-bitcoin-message-over-the-b9fd5e8fe2e8
21495315,Historical Rankings of Presidents of the United States,2019-11-09T23:41:11.000Z,2,0,https://en.wikipedia.org/wiki/Historical_rankings_of_presidents_of_the_United_States
21495313,Google enlists outside help to clean up Android’s malware mess,2019-11-09T23:40:44.000Z,1,0,https://arstechnica.com/gadgets/2019/11/google-enlists-outside-help-to-clean-up-androids-malware-mess/
21495304,Cloud agnostic Cloudscript,2019-11-09T23:39:25.000Z,2,0,http://github.com/simonski/cloudscript
21495278,"Copenhagen: The City That Cycles with the Young, the Old, the Busy and the Dead",2019-11-09T23:31:56.000Z,3,0,https://www.nytimes.com/2019/11/09/world/europe/biking-copenhagen.html
21495267,What Menopause Does to Women’s Brains,2019-11-09T23:30:07.000Z,1,0,https://www.theatlantic.com/health/archive/2019/11/menopause-alzheimers/601642/
21495265,Death Stranding Gameplay Walkthrough Part 1 [1080p HD PS4 Pro] – No Commentary,2019-11-09T23:29:55.000Z,1,0,https://www.youtube.com/watch?v=CXA0CMr3hq0&feature=emb_title
21495260,Learn Linux 101: Graphical Desktops,2019-11-09T23:29:20.000Z,3,1,https://developer.ibm.com/tutorials/l-lpic1-106-2/
21495257,Internet Mail 2000,2019-11-09T23:28:22.000Z,2,1,http://cr.yp.to/im2000.html
21495253,Subscribers Are Your True Fans,2019-11-09T23:27:49.000Z,4,0,https://www.revenuecat.com/2019/09/24/subscribers-are-your-true-fans
21495225,The average American eats 17 teaspoons of added sugar daily,2019-11-09T23:23:55.000Z,86,68,https://www.theguardian.com/commentisfree/2019/nov/07/the-average-american-eats-17-teaspoons-of-added-sugar-daily-its-killing-us
21495217,Fast-SRGAN: Deep learning model to convert low res pictures to high res,2019-11-09T23:23:12.000Z,22,0,https://github.com/HasnainRaz/Fast-SRGAN
21495211,Blow to Amazon as Seattle socialist looks to have triumphed in key vote,2019-11-09T23:22:39.000Z,3,0,https://www.theguardian.com/us-news/2019/nov/09/seattle-amazon-kshama-sawant-socialist-elections
21495164,"UpHabit, Dex, and the Stilted Rise of the Personal CRM",2019-11-09T23:12:35.000Z,3,0,https://www.theatlantic.com/technology/archive/2019/11/personal-crm-software-uphabit-dex-google-spreadsheets/601531/
21495151,The Internet’s First Hit File Format Wasn’t the MP3. It Was MIDI,2019-11-09T23:10:36.000Z,3,0,https://www.vice.com/en_us/article/a359xe/the-internets-first-hit-file-format-wasnt-the-mp3-it-was-midi
21495140,Example of VueJS app with Spotify API authentication and data fetching,2019-11-09T23:08:11.000Z,1,0,https://github.com/klswcz/spotify-auth-code-example-vue
21495136,Recent Immigrants Turned Virginia from Deep Red to Solid Blue – NYT,2019-11-09T23:07:54.000Z,4,1,https://www.nytimes.com/2019/11/09/us/politics/virginia-elections-democrats-republicans.html
21495125,Plane Accidentally Flew Around the World,2019-11-09T23:06:36.000Z,2,0,https://medium.com/s/story/the-long-way-round-the-plane-that-accidentally-circumnavigated-the-world-c04ca734c6bb
21495100,Is The Economist left- or right-wing?,2019-11-09T23:03:36.000Z,4,2,https://www.economist.com/the-economist-explains/2013/09/02/is-the-economist-left-or-right-wing
21495092,Delegate Prototypes and Unintended Side-Effects,2019-11-09T23:02:31.000Z,2,0,https://medium.com/@nick.best5456/delegate-prototypes-and-unintended-side-effects-5123b376891b
21495086,Basic Reinforcement Learning: Pong Automation Explained,2019-11-09T23:01:10.000Z,3,0,https://medium.com/gradientcrescent/fundamentals-of-reinforcement-learning-automating-pong-in-using-a-policy-model-an-implementation-b71f64c158ff
21495075,MEGA65: A Modern 8 bit computer,2019-11-09T22:59:02.000Z,1,0,http://mega65.org/
21495063,Car loans are dragging Americans underwater,2019-11-09T22:55:54.000Z,1,0,https://www.axios.com/car-loan-borrower-debt-negative-equity-2fa0f617-c6ef-466c-9611-eb48f872cff0.html
21495036,Sokol – Simple STB-style cross-platform libraries for C and C++,2019-11-09T22:50:21.000Z,2,0,https://github.com/floooh/sokol
21495020,Ask HN: How do you evaluate the reliability of an open source project,2019-11-09T22:47:08.000Z,2,0,
21494989,One of the world’s most advanced hacking groups debuts new Titanium backdoor,2019-11-09T22:43:10.000Z,1,0,https://arstechnica.com/information-technology/2019/11/newly-discovered-titanium-backdoor-employs-clever-ways-to-go-undetected/
21494987,Ask HN: How should the future of online identity look like?,2019-11-09T22:42:38.000Z,3,0,
21494968,66% of US workers would move abroad for a better-paying job,2019-11-09T22:39:23.000Z,5,0,https://www.cnbc.com/2019/11/09/randstad-66percent-of-us-workers-would-move-abroad-for-a-better-paying-job.html
21494964,Show HN: Generate hashdeep compatible output for an Azure Blob Storage container,2019-11-09T22:38:42.000Z,2,0,https://github.com/evenh/az-blob-hashdeep
21494934,How to become TikTok famous,2019-11-09T22:34:14.000Z,2,0,https://www.ft.com/content/dd7234e8-fcb9-11e9-98fd-4d6c20050229
21494920,Liberalism According to The Economist,2019-11-09T22:32:52.000Z,2,0,https://www.newyorker.com/magazine/2019/11/11/liberalism-according-to-the-economist
21494902,"WeWork to sell MeetUp, cut jobs in 90-day turnaround plan",2019-11-09T22:30:49.000Z,1,0,https://www.detroitnews.com/story/business/2019/11/08/wework-sell-meetup-cut-jobs-day-turnaround-plan/40574583/
21494847,Ask HN: What was your biggest mental shift when learning Rust?,2019-11-09T22:23:41.000Z,4,1,
21494822,Neo-Nazi Web Forum Iron March Has SQL Database Dumped on the Internet Archive,2019-11-09T22:20:33.000Z,4,0,https://gizmodo.com/neo-nazi-web-forum-iron-march-has-sql-database-dumped-o-1839721580
21494794,Experts Back Mandatory Bike Helmets but Not All Cyclists Are Sold,2019-11-09T22:15:41.000Z,1,0,https://www.nytimes.com/2019/11/09/us/bike-safety-helmets.html
21494790,You need to outthink your lazy brain (2013),2019-11-09T22:15:04.000Z,6,1,https://bigthink.com/in-their-own-words/explanation-freeze-sometimes-you-need-to-outhink-your-lazy-brain
21494766,My web site turned 1 year old,2019-11-09T22:12:03.000Z,1,2,
21494752,Good and Not Evil: The Advent of Ethos Licensing,2019-11-09T22:10:12.000Z,2,0,https://heathermeeker.com/2019/11/09/good-and-not-evil-the-advent-of-ethos-licensing/
21494750,A former WeWork employee is suing over Adam Neumann's $1.7B golden parachute,2019-11-09T22:09:18.000Z,38,6,https://markets.businessinsider.com/news/wework-ex-employee-sues-adam-neumann-2-billion-leaving-deal-2019-11-1028675038
21494703,Hasekura Tsunenaga,2019-11-09T22:01:42.000Z,1,0,https://en.wikipedia.org/wiki/Hasekura_Tsunenaga
21494690,Where Do Niche Streaming Services Fit in a Sea of Services?,2019-11-09T22:00:08.000Z,2,0,https://www.hollywoodreporter.com/news/do-niche-streamers-fit-a-sea-services-1253172
21494685,A suggestion for improving the comments on Hacker News,2019-11-09T21:59:31.000Z,3,2,https://hruvulum.github.io/201911090.html
21494673,Viral Tweet About Apple Card Leads to Goldman Sachs Probe,2019-11-09T21:57:36.000Z,129,148,https://www.bloomberg.com/news/articles/2019-11-09/viral-tweet-about-apple-card-leads-to-probe-into-goldman-sachs
21494646,Itertools Combinatorics,2019-11-09T21:53:36.000Z,2,0,https://twitter.com/tandavaya/status/1193123904052776961
21494641,The High Cost of Free Incentive Parking,2019-11-09T21:52:51.000Z,2,0,http://www.cat-bus.com/2016/07/incentive-parking/
21494640,"As L.A. ports automate, truckers cheer",2019-11-09T21:52:26.000Z,2,0,https://www.latimes.com/business/story/2019-11-07/port-automation-dockworkers-vs-truckers
21494637,The Porch Pirate of Potrero Hill Can’t Believe It Came to This,2019-11-09T21:51:44.000Z,1,0,https://www.theatlantic.com/technology/archive/2019/11/stealing-amazon-packages-age-nextdoor/598156/
21494620,Federal Reserve officials say they 'can't afford to ignore' climate change,2019-11-09T21:49:58.000Z,14,1,https://finance.yahoo.com/news/federal-reserve-officials-host-climate-change-conference-121222994.html
21494558,Deflection Tactics Used by Fossil Fuel Lobby Against Climate Change,2019-11-09T21:39:32.000Z,11,0,https://www.theguardian.com/science/2019/nov/09/doomism-new-tactic-fossil-fuel-lobby
21494523,Naïve Bayes for Machine Learning – From Zero to Hero,2019-11-09T21:32:52.000Z,2,0,https://blog.floydhub.com/naive-bayes-for-machine-learning/
21494522,"Albert Einstein, Scientist and Mob Idol",2019-11-09T21:32:51.000Z,3,0,https://www.newyorker.com/magazine/1933/12/02/scientist-mob-idol-1
21494510,Magnetic accessories might interfere with iPhone cameras,2019-11-09T21:31:10.000Z,1,0,https://support.apple.com/en-us/HT208747
21494506,Data shows a surprising campus free speech problem,2019-11-09T21:30:05.000Z,8,2,https://www.vox.com/policy-and-politics/2018/8/3/17644180/political-correctness-free-speech-liberal-data-georgetown
21494502,Ask HN: Why do you host your blog on Medium?,2019-11-09T21:29:51.000Z,10,5,
21494491,Why Gen Z’s 'ok boomer' retort–and the responses to it–are so powerful,2019-11-09T21:28:12.000Z,6,13,https://medium.com/there-is-no-design/if-youre-mad-about-ok-boomer-you-re-part-of-the-problem-a571b5b85d68
21494469,Death to the Space Infidels (Tabs vs. Spaces),2019-11-09T21:25:31.000Z,1,1,https://blog.codinghorror.com/death-to-the-space-infidels/
21494437,Ask HN: How do you pronounce 'data'?,2019-11-09T21:21:16.000Z,1,2,
21494424,Omnitracs Resolves ELD Disruption That Had Drivers Reverting to Paper Logs,2019-11-09T21:19:07.000Z,1,1,https://www.ttnews.com/articles/omnitracs-eld-disruption-prompts-drivers-use-paper-logs
21494400,Searching in a heap is NP-complete,2019-11-09T21:15:09.000Z,2,0,https://howonlee.github.io/2019/11/09/Heap-20Search-20Is-20NP-20Complete.html
21494386,An old-school shell hack on a line printer,2019-11-09T21:12:45.000Z,4,0,https://drewdevault.com/2019/10/30/Line-printer-shell-hack.html
21494373,Does Employee Happiness Have an Impact on Productivity?,2019-11-09T21:10:18.000Z,1,0,https://papers.ssrn.com/sol3/papers.cfm?abstract_id=3470734
21494357,Bonds Based on Ergo (Or the “Yield Protocol”),2019-11-09T21:07:03.000Z,1,0,https://www.ergoforum.org/t/bonds-based-on-ergo-or-the-yield-protocol/128
21494350,"Technology Won’t Kill Your Job, Capitalism Will",2019-11-09T21:05:25.000Z,8,1,https://medium.com/discourse/technology-wont-kill-your-job-capitalism-will-901770857ad4
21494341,"After Lion Air crash, Boeing doubled down on faulty 737 MAX assumptions",2019-11-09T21:03:30.000Z,4,0,https://www.seattletimes.com/business/boeing-aerospace/after-lion-air-crash-boeing-doubled-down-on-faulty-737-max-assumptions/
21494330,"Billionaires Benefiting from a Tax Break to Help the Poor, Congress Investigates",2019-11-09T21:02:02.000Z,26,5,https://www.propublica.org/article/billionaires-keep-benefiting-from-a-tax-break-to-help-the-poor-now-congress-wants-to-investigate
21494326,Avoid Premature Optimization,2019-11-09T21:00:49.000Z,1,0,https://effectiviology.com/premature-optimization/
21494320,The Last Days of Legal Cockfighting in Puerto Rico,2019-11-09T21:00:14.000Z,2,0,https://www.nytimes.com/2019/11/09/us/puerto-rico-cockfighting-ban.html
21494311,US man convicted of murder says life term completed when he briefly 'died',2019-11-09T20:58:56.000Z,2,0,https://www.theguardian.com/us-news/2019/nov/09/man-iowa-prisoner-murder-life-sentence
21494307,Corellium vs. Apple Response and Counterclaim [pdf],2019-11-09T20:58:21.000Z,1,0,https://drive.google.com/file/d/17aLLlA_OqUXg2gZITKu1l1TRpOZL1445/view
21494295,Narcissistic CEOs weaken collaboration and integrity,2019-11-09T20:56:58.000Z,149,79,https://www.gsb.stanford.edu/insights/narcissistic-ceos-weaken-collaboration-integrity
21494294,Can a closed-source programming language survive?,2019-11-09T20:56:48.000Z,2,0,https://softwareengineering.stackexchange.com/questions/250833/can-a-closed-source-programming-language-survive
21494276,A Futhark Implementation of Ray Tracing: The Next Week,2019-11-09T20:52:35.000Z,3,0,https://github.com/athas/raytracingthenextweekinfuthark/
21494274,Hilary Fisher Page,2019-11-09T20:52:26.000Z,2,0,https://en.wikipedia.org/wiki/Hilary_Fisher_Page
21494246,Updates to Our Terms of Service,2019-11-09T20:47:11.000Z,2,0,https://blog.linkedin.com/2019/november/5/updates-to-our-terms-of-service
21494236,Tips for a Junior Developer,2019-11-09T20:45:05.000Z,1,0,http://www.pearlleff.com/seven-tips-for-a-junior-developer
21494225,The Stoic of Open Source,2019-11-09T20:43:27.000Z,3,0,https://amasad.me/stoic-oss
21494215,"Goals, Process, and Challenges of Exploratory Data Analysis: An Interview Study",2019-11-09T20:41:19.000Z,3,0,https://arxiv.org/abs/1911.00568
21494204,Position Independent Code (PIC) in Shared Libraries,2019-11-09T20:39:26.000Z,1,0,https://eli.thegreenplace.net/2011/11/03/position-independent-code-pic-in-shared-libraries
21494175,Edge-Notched Card,2019-11-09T20:35:15.000Z,2,2,https://en.wikipedia.org/wiki/Edge-notched_card
21494163,Right-Sizing Minecraft (A Whirlwind Exercise in Scientific Notation),2019-11-09T20:33:35.000Z,1,0,https://leosstemhacks.wordpress.com/2019/11/08/right-sizing-minecraft-a-whirlwind-exercise-in-scientific-notation/
21494147,Ask HN: How to connect serverless lambda functions to custom domain?,2019-11-09T20:31:32.000Z,1,1,
21494134,A big software system with some missing features,2019-11-09T20:30:08.000Z,2,0,https://twitter.com/unclebobmartin/status/1193153574655733760
21494130,A Sociologist Examines American “White Fragility”,2019-11-09T20:29:46.000Z,6,0,https://www.newyorker.com/books/page-turner/a-sociologist-examines-the-white-fragility-that-prevents-white-americans-from-confronting-racism
21494118,The extraordinary story of Jo Whitehead – female soldier of the first world war,2019-11-09T20:27:53.000Z,1,0,https://historiansforhistory.wordpress.com/2019/11/05/gender-service-and-the-extraordinary-story-of-leslie-joy-whitehead-female-soldier-of-the-first-world-war-by-natasha-stoyce/
21494114,"Publishers Should Be Making E-Book Licensing Better, Not Worse",2019-11-09T20:27:01.000Z,2,0,https://www.eff.org/deeplinks/2019/11/publishers-should-be-making-e-book-licensing-better-not-worse
21494099,"Who, the Top Causes of Death",2019-11-09T20:25:18.000Z,2,0,https://www.who.int/news-room/fact-sheets/detail/the-top-10-causes-of-death
21494088,The economic toll of climate change,2019-11-09T20:24:12.000Z,1,0,https://www.axios.com/economic-effects-climate-change-federal-reserve-7fe5ae52-4e92-4340-a3da-80dc5d126fd0.html
21494042,Sklearn standardscaler to transform input dataset in Python,2019-11-09T20:16:08.000Z,2,0,https://www.codespeedy.com/scikit-learn-standardscaler-to-transform-input-dataset-values/
21494040,"Center for Applied Data Ethics Tech Policy Workshop (11/16, San Francisco)",2019-11-09T20:15:59.000Z,1,0,https://www.sfdatainstitute.org/abstracts.html
21494033,Hundreds of Google accounts suspended for using emoji in live chat,2019-11-09T20:15:27.000Z,2,1,https://mobile.twitter.com/markiplier/status/1193015864364126208
21494025,Two Brothers Started a $3.5K/Month Side Hustle Sells Custom Maps,2019-11-09T20:14:39.000Z,2,0,https://www.starterstory.com/custom-maps-posters
21493991,"The Us military, algorithmic warfare, and big tech",2019-11-09T20:09:25.000Z,1,0,https://venturebeat.com/2019/11/08/the-u-s-military-algorithmic-warfare-and-big-tech/
21493971,The Stoic of Open Source,2019-11-09T20:07:41.000Z,2,0,https://web.archive.org/web/20190322104310/https://amasad.me/stoic-oss
21493962,How Natural Is Numeracy?,2019-11-09T20:06:18.000Z,1,0,https://aeon.co/essays/why-do-humans-have-numbers-are-they-cultural-or-innate
21493939,The Legend of A-N-N-A,2019-11-09T20:03:31.000Z,1,0,https://features.propublica.org/illinois-sundown-towns/legend-of-anna/
21493929,Parallel Programming in Split-C [pdf],2019-11-09T20:01:44.000Z,2,0,https://www.cs.cmu.edu/~seth/papers/culler-sc93.pdf
21493899,Retro Rampage: Writing a Wolfenstein-Like Game in Swift,2019-11-09T19:58:05.000Z,1,0,https://github.com/nicklockwood/RetroRampage
21493897,Reset and Cancel Buttons,2019-11-09T19:57:43.000Z,2,0,https://www.nngroup.com/articles/reset-and-cancel-buttons/
21493892,Transkernel: Bridging Monolithic Kernels to Peripheral Cores [pdf],2019-11-09T19:56:47.000Z,2,0,https://www.usenix.org/system/files/atc19-guo_0.pdf
21493853,Productive and Safe Rust Binding for OCR,2019-11-09T19:52:33.000Z,14,4,https://github.com/houqp/leptess
21493825,How Secure Is Your Face? Racing Against Hackers in Biometrics,2019-11-09T19:47:31.000Z,2,0,https://semiengineering.com/how-secure-is-your-face/
21493798,"Great apes pass a false-belief test, hinting at a theory of mind",2019-11-09T19:43:27.000Z,2,0,https://arstechnica.com/science/2019/11/great-apes-pass-a-false-belief-test-hinting-at-a-theory-of-mind/
21493791,Why the tech platforms lost interest in streaming live sports,2019-11-09T19:42:21.000Z,1,0,https://simonowens.substack.com/p/why-the-tech-platforms-lost-interest
21493773,"Ben Horowitz on a Stabbing, Genghis Khan, and Corporate Culture",2019-11-09T19:40:01.000Z,2,0,https://www.wired.com/story/ben-horowitz-andreessen-horowitz-wired25/
21493762,How Scientists Got Climate Change So Wrong,2019-11-09T19:38:01.000Z,5,0,https://www.nytimes.com/2019/11/08/opinion/sunday/science-climate-change.html
21493761,"Fast Markov chains in ~20 lines of sh, grep, cut and Awk",2019-11-09T19:37:40.000Z,292,34,https://0x0f0f0f.github.io/posts/2019/11/really-fast-markov-chains-in-~20-lines-of-sh-grep-cut-and-awk/
21493759,Bypass Paywall Extension,2019-11-09T19:37:05.000Z,3,0,https://github.com/iamadamdev/bypass-paywalls-chrome
21493743,Is Writing More Important Than Programming? (2006),2019-11-09T19:35:31.000Z,5,2,https://blog.codinghorror.com/is-writing-more-important-than-programming/
21493733,Going Soft: Taking (un)design cues from nature,2019-11-09T19:33:35.000Z,2,0,https://www.otherlab.com/blog-posts/undesigning
21493711,Ask HN: Any mainstream messenger that is reliable and treats us as adults?,2019-11-09T19:29:02.000Z,1,5,
21493705,Perfect Select All Checkbox in 3 Lines of Aurelia Code,2019-11-09T19:28:34.000Z,1,0,http://davismj.me/blog/aurelia-checkboxes/
21493700,"Airplane, Flying Across Africa in a Homebrew Airplane",2019-11-09T19:27:46.000Z,1,0,https://www.youtube.com/watch?v=BhEDywDP768
21493699,Choose Your Future,2019-11-09T19:27:33.000Z,1,0,https://liam-on-linux.livejournal.com/68259.html
21493696,Ask HN: What are people's main sources of articles these days?,2019-11-09T19:27:05.000Z,1,1,
21493695,Margarita Salas Has Died,2019-11-09T19:27:01.000Z,5,1,
21493687,What Is Kubernetes? The Epic Explainer,2019-11-09T19:25:49.000Z,4,0,https://www.codewall.co.uk/what-is-kubernetes-what-is-it-used-for/
21493679,Support Sponsorable Go Packages,2019-11-09T19:24:44.000Z,2,0,https://github.com/joshuabezaleel/go-support
21493673,AI Decodes Your Brainwaves and Draws What You’re Looking At,2019-11-09T19:23:33.000Z,4,1,https://futurism.com/the-byte/ai-draws-decodes-brainwaves
21493663,An Autoconf Primer for R Package Authors,2019-11-09T19:21:20.000Z,1,0,https://unconj.ca/blog/an-autoconf-primer-for-r-package-authors.html
21493650,The 50 Most Important Websites of All Time,2019-11-09T19:19:47.000Z,1,0,https://www.popularmechanics.com/culture/g29575328/most-important-websites/
21493644,China’s electric car makers battle for survival after subsidies scaled back,2019-11-09T19:19:13.000Z,1,0,https://www.bloomberg.com/news/articles/2019-10-30/china-s-top-electric-carmakers-are-mired-as-subsidy-cuts-bite
21493605,Android user who tried the Apple Watch- it's now the only I'll recommend,2019-11-09T19:14:14.000Z,2,1,https://www.androidpolice.com/2019/11/08/im-an-android-user-who-tried-the-apple-watch-for-a-month-its-now-the-only-smartwatch-ill-recommend/
21493566,Targeted ads are one of the world's most destructive trends,2019-11-09T19:08:57.000Z,75,46,https://www.theguardian.com/world/2019/nov/05/targeted-ads-fake-news-clickbait-surveillance-capitalism-data-mining-democracy
21493559,Fitbit Is Doomed,2019-11-09T19:08:18.000Z,2,0,https://www.zdnet.com/article/fitbit-is-doomed-why-everything-google-buys-turns-to-garbage/
21493544,Show HN: Weedtalks – Get high and speak with your friends!,2019-11-09T19:06:22.000Z,2,0,https://weedtalks.io/
21493527,So you want to make a sofa (2015),2019-11-09T19:03:49.000Z,2,0,https://medium.com/@dhavatar/so-you-want-to-make-a-sofa-83ffb4d6ff4
21493521,Acetaminophen in Pregnancy May Increase Risk of ADHD and Autism in Childhood,2019-11-09T19:03:10.000Z,4,0,https://jamanetwork.com/journals/jamapsychiatry/article-abstract/2753512
21493494,Tesla reaches preliminary agreement with CATL battery supplier in China,2019-11-09T18:59:47.000Z,2,0,https://www.bloomberg.com/news/articles/2019-11-05/tesla-is-said-to-reach-preliminary-battery-supply-deal-with-catl
21493474,Congress to FCC: Where’s the damn report on mobile telcos selling location data?,2019-11-09T18:57:02.000Z,2,0,https://www.theregister.co.uk/2019/11/08/congress_fcc_location_data/
21493459,Analyzing Android's CVE-2019-2215 (/dev/binder UAF),2019-11-09T18:55:25.000Z,2,0,https://dayzerosec.com/posts/analyzing-androids-cve-2019-2215-dev-binder-uaf/
21493452,McKinsey faces criminal inquiry over bankruptcy case conduct,2019-11-09T18:54:47.000Z,1,0,https://www.nytimes.com/2019/11/08/business/mckinsey-criminal-investigation-bankruptcy.html
21493447,Nonfaculty staff push for action at the expense of free inquiry,2019-11-09T18:54:23.000Z,1,0,https://www.wsj.com/articles/higher-educations-enemy-within-11573251941?mod=rsswn
21493444,Deploying Scala.js App on GitHub Pages with Travis CI,2019-11-09T18:53:53.000Z,13,0,https://warisradji.com/2019/11/08/deploying-scala-js-app-on-github-pages-with-travis-ci/
21493420,Ethereum Studio is a tool to learn about building on Ethereum,2019-11-09T18:50:18.000Z,3,0,https://studio.ethereum.org/
21493415,Code is read much more often than it is written,2019-11-09T18:49:57.000Z,3,0,https://devblogs.microsoft.com/oldnewthing/?p=27343
21493412,More Borrowers Are Going Underwater on Car Loans,2019-11-09T18:49:14.000Z,2,0,https://www.wsj.com/articles/a-45-000-loan-for-a-27-000-ride-more-borrowers-are-going-underwater-on-car-loans-11573295400?mod=rsswn
21493410,Show HN: LuaJIT assembler/assembly language for direct bytecode programming,2019-11-09T18:49:07.000Z,127,20,https://github.com/rochus-keller/LjTools
21493403,France suggested to make suppliers liable for product security,2019-11-09T18:48:12.000Z,1,0,https://blog.lukaszolejnik.com/highlights-of-french-cybersecurity-strategy/
21493399,Reber Plan,2019-11-09T18:47:50.000Z,1,0,https://en.wikipedia.org/wiki/Reber_Plan
21493381,NPM adds `funding` support to package.json,2019-11-09T18:45:20.000Z,3,2,https://github.com/npm/rfcs/blob/latest/accepted/0017-add-funding-support.md
21493348,A Chat with Aaron Swartz (2007),2019-11-09T18:40:49.000Z,13,1,http://blogoscoped.com/archive/2007-05-07-n78.html
21493344,"JavaScript: Private Fields, Public Worries",2019-11-09T18:40:11.000Z,3,0,https://medium.com/virtuslab/private-fields-public-worries-b8c34d16c372
21493336,Infrastructure as code in AZURE and the sad state of ARM templates,2019-11-09T18:39:15.000Z,2,0,https://itnext.io/azure-arm-templates-are-broken-671f32ea63c5?source=friends_link&sk=9c6fca12722615c2a2276f19969a8d1f
21493310,Container Isolation Gone Wrong,2019-11-09T18:35:52.000Z,2,0,https://sysdig.com/blog/container-isolation-gone-wrong/
21493305,Hot Properties – Eight of History’s Most Fought over Places,2019-11-09T18:34:52.000Z,1,0,https://militaryhistorynow.com/2014/09/15/hot-properties-seven-of-historys-most-contested-places/
21493271,Lessons from Stockholm’s bold congestion-reduction plan,2019-11-09T18:30:41.000Z,1,0,https://www.fastcompany.com/90426090/5-lessons-from-stockholms-bold-congestion-reduction-plan-for-any-city-to-copy
21493251,Investigation into Uber Self-Driving Car Crash Reveal Lax Attitude Toward Safety,2019-11-09T18:27:31.000Z,1,0,https://spectrum.ieee.org/cars-that-think/transportation/self-driving/ntsb-investigation-into-deadly-uber-selfdriving-car-crash-reveals-lax-attitude-toward-safety
