objectID,title,created_at,points,num_comments,url
21487490,your boss doesn't want you to die at your desk (but you still might),2019-11-08T22:18:08.000Z,1,1,https://www.haleymbryant.com/blog/dont-die-at-your-desk
21487487,Blizzard VP wants blitzchung’s suspension ‘reduced more or eliminated’,2019-11-08T22:17:41.000Z,6,1,https://www.washingtonpost.com/video-games/2019/11/08/blizzard-vp-overwatch-director-jeff-kaplan-wants-blitzchungs-suspension-reduced-more-or-eliminated/
21487478,Facebook Empowers Racism Against Its Employees of Color,2019-11-08T22:16:56.000Z,31,1,https://medium.com/@blindfb2020/facebook-empowers-racism-against-its-employees-of-color-fbbfaf55ab76
21487470,Microsoft revealed to be funding Israeli surveillance on Palestinians,2019-11-08T22:16:14.000Z,3,0,https://mondoweiss.net/2019/11/microsoft-revealed-to-be-funding-israeli-surveillance-on-palestinians/
21487458,Schema Management CLI for MySQL,2019-11-08T22:15:06.000Z,2,0,https://github.com/skeema/skeema
21487439,Voice Control Games with Amazon Alexa Support,2019-11-08T22:13:34.000Z,1,0,
21487423,Mark Twain playing with electricity in Nikola Tesla's lab in 1894 (2013),2019-11-08T22:11:41.000Z,116,18,http://www.openculture.com/2013/10/mark-twain-plays-with-electricity-in-nikola-teslas-lab-photo-1894.html
21487390,Months-Old 'Ghost Texts' Were Sent by This Company You Never Heard Of,2019-11-08T22:08:12.000Z,2,0,https://www.vice.com/en_us/article/8xwj9g/months-old-ghost-texts-were-sent-by-this-company-you-never-heard-of
21487379,‘Noise’ in the Brain’s Vision Areas Encodes Body Movements,2019-11-08T22:07:41.000Z,2,0,https://www.quantamagazine.org/noise-in-the-brains-vision-areas-encodes-body-movements-20191107/
21487366,"Don’t Worry, These Gangly-Armed Cartoons Are Here to Protect You from Big Tech",2019-11-08T22:06:13.000Z,1,0,https://eyeondesign.aiga.org/dont-worry-these-gangley-armed-cartoons-are-here-to-protect-you-from-big-tech/
21487355,Ask HN: How do you show your manager that you do not need “handholding”?,2019-11-08T22:05:29.000Z,1,0,
21487352,Apple: Reading the Quarterly Leaves,2019-11-08T22:05:00.000Z,1,0,https://mondaynote.com/apple-reading-the-quarterly-leaves-33edf56ba43d
21487349,Naïve Bayes for Machine Learning – From Zero to Hero,2019-11-08T22:04:29.000Z,4,0,https://blog.floydhub.com/naive-bayes-for-machine-learning/
21487345,Initial Dwarf Support in Chrome DevTools,2019-11-08T22:04:12.000Z,2,0,https://twitter.com/ChromeDevTools/status/1192803818024710145
21487318,Google Censorship Buries [Alternative Health Website],2019-11-08T22:01:23.000Z,4,3,https://articles.mercola.com/sites/articles/archive/2019/11/08/google-censorship-buries-mercola.aspx
21487264,The Real Moral Dilemma of Self-Driving Cars,2019-11-08T21:57:06.000Z,1,0,https://onezero.medium.com/the-real-moral-dilemma-of-self-driving-cars-ab6bb5f216b
21487234,Ghost wants to retrofit your car so it can drive itself on highways in 2020,2019-11-08T21:53:35.000Z,1,0,https://techcrunch.com/2019/11/07/ghost-wants-to-retrofit-your-car-so-it-can-drive-itself-on-highways-by-2020/
21487191,Who is hiring entry-level software engineers?,2019-11-08T21:48:11.000Z,5,4,
21487165,Theranos founder Elizabeth Holmes wins courtroom skirmish,2019-11-08T21:45:08.000Z,1,0,https://www.mercurynews.com/2019/11/07/theranos-founder-elizabeth-holmes-wins-courtroom-skirmish/
21487156,Show HN: A simple CRM for commercial real estate,2019-11-08T21:44:09.000Z,2,1,https://targets.towerhunt.com/
21487150,How to Do Business in China Without Going to Prison,2019-11-08T21:43:28.000Z,2,2,https://www.chinalawblog.com/2019/07/how-to-do-business-in-china-without-going-to-prison.html
21487090,The Most Entertaining Guide to Landing Page Optimization You'll Ever Read,2019-11-08T21:37:53.000Z,3,0,https://moz.com/blog/most-entertaining-guide-to-landing-page-optimization
21487068,Happy Friday What If You Always Had It Off? Why Don’t You?,2019-11-08T21:34:15.000Z,1,0,https://www.nytimes.com/2019/11/08/business/four-day-work-week.html
21487066,Ask HN: Is PoW FDA?,2019-11-08T21:34:13.000Z,1,1,
21487036,WeWork says it will divest all ‘non-core’ businesses,2019-11-08T21:31:24.000Z,2,0,https://www.cnbc.com/2019/11/08/wework-says-it-will-divest-all-non-core-businesses.html
21487026,“okay boomer” summons Google Assistant,2019-11-08T21:30:19.000Z,8,1,https://twitter.com/DavidSHolz/status/1192916672362860544
21486980,The Dimensions of City Blocks,2019-11-08T21:26:01.000Z,1,0,https://vizual-statistix.tumblr.com/post/84385555051/a-block-is-by-no-means-a-standard-unit-of
21486945,Harvard business school dean to step down,2019-11-08T21:22:15.000Z,2,0,https://www.hbs.edu/news/releases/Pages/nitin-nohria-steps-down.aspx
21486925,"Jesus, Mary, and Mary",2019-11-08T21:20:38.000Z,2,0,https://www.nybooks.com/articles/2019/11/21/jesus-mary-mary-magdalene/
21486914,"Rather Than Saving Public Transportation, We Handed Millions to Lyft and Uber",2019-11-08T21:19:39.000Z,28,8,https://medium.com/@ilyaberger/we-had-a-chance-to-save-public-transportation-instead-we-handed-millions-to-lyft-and-uber-and-77860ffdedfd
21486836,How outrage mobs silence academics – and what we can do to stop them,2019-11-08T21:13:29.000Z,11,15,https://bigthink.com/Charles-Koch-Foundation/outrage-mobs
21486833,The Rise of Space Force,2019-11-08T21:13:21.000Z,2,0,https://urbancoldspots.blogspot.com/p/il-concetto-di-difesa-spaziale-non-e-un.html
21486796,XHelper Malware for Android,2019-11-08T21:09:43.000Z,2,0,https://www.schneier.com/blog/archives/2019/11/xhelper_malware.html#comments
21486790,25+ Linux Commands Raspberry Pi Users Need to Know,2019-11-08T21:09:20.000Z,3,0,"https://www.tomshardware.com/reviews/raspberry-pi-command-line-commands,6159.html"
21486772,Characterizing people as non-linear 1st-order components in software development,2019-11-08T21:07:27.000Z,1,1,https://ameyakarve.wordpress.com/2012/07/22/characterizing-people-as-non-linear-1st-order-components-in-software-development-cockburn-us/
21486765,"Who Owns HIV-Prevention Drugs? The Taxpayers, U.S. Says",2019-11-08T21:07:02.000Z,10,0,https://www.nytimes.com/2019/11/08/health/hiv-prevention-truvada-patents.html
21486728,2019 GitHub State of the Octoverse Report,2019-11-08T21:03:24.000Z,2,0,https://octoverse.github.com/#home
21486706,A Calculator for the Billionaires – Elizabeth Warren,2019-11-08T21:02:21.000Z,16,16,https://elizabethwarren.com/calculator/ultra-millionaire-tax
21486676,Hollywood Antitrust Case of 1948,2019-11-08T20:58:53.000Z,2,0,"https://en.wikipedia.org/wiki/United_States_v._Paramount_Pictures,_Inc."
21486674,The Woman who gave us the Science of Normal life,2019-11-08T20:58:34.000Z,1,0,http://nautil.us/issue/46/Balance/the-woman-who-gave-us-the-science-of-normal-life
21486660,Aplazan para el lunes medida de coerción a la fiscal Margarita Hernández,2019-11-08T20:57:44.000Z,1,0,https://www.diariolibre.com/actualidad/justicia/aplazan-para-el-lunes-medida-de-coercion-a-la-fiscal-margarita-hernandez
21486655,Businesses are stocking up for an expected downturn,2019-11-08T20:57:14.000Z,5,0,https://www.axios.com/businesses-spending-indicators-recession-533481fc-dba7-4b5c-add4-c11628c335bc.html
21486650,UK shows how not to regulate tech,2019-11-08T20:56:46.000Z,4,0,https://www.bbc.co.uk/news/election-2019-50350091
21486639,RPC: Remote Procedure Call Protocol Specification (1988),2019-11-08T20:55:24.000Z,3,0,https://tools.ietf.org/html/rfc1050
21486626,Design Principles of Biological Circuits,2019-11-08T20:54:08.000Z,3,0,https://www.lesswrong.com/posts/bNXdnRTpSXk9p4zmi/book-review-design-principles-of-biological-circuits
21486609,Growing a Language (1998) [pdf],2019-11-08T20:53:06.000Z,2,0,https://www.cs.virginia.edu/~evans/cs655/readings/steele.pdf
21486571,Role of Proximity in Interaction Design,2019-11-08T20:49:36.000Z,1,0,https://medium.com/@nitishkmrk/proximity-in-product-interaction-design-deb527b1c336
21486566,French Word-Borrowings in England During the Renaissance (1947),2019-11-08T20:49:21.000Z,2,0,https://ecommons.luc.edu/cgi/viewcontent.cgi?article=1185&context=luc_theses
21486547,Tesla Car Sales 2012 to Sept 2019 Timeline,2019-11-08T20:47:19.000Z,3,0,https://www.youtube.com/watch?v=4v-c7i9Hjrs&feature=youtu.be
21486540,Twitter in India: Why Was Rival Mastodon Trending?,2019-11-08T20:46:58.000Z,19,1,https://www.bbc.co.uk/news/world-asia-india-50343054
21486498,Build your own Machine Learning web service with Django,2019-11-08T20:41:43.000Z,2,0,https://github.com/pplonski/my_ml_service
21486494,We do not use foreign keys (2016),2019-11-08T20:41:20.000Z,342,305,https://github.com/github/gh-ost/issues/331#issuecomment-266027731
21486485,Ask HN: What Happened to Memristors?,2019-11-08T20:39:42.000Z,2,0,
21486479,"Phantom Stacks: If You Look Too Hard, They Aren't There (1980)",2019-11-08T20:38:37.000Z,1,0,https://dspace.mit.edu/handle/1721.1/6331
21486451,HP Confirms it has received a proposal from Xerox about being acquired,2019-11-08T20:36:09.000Z,2,0,https://techcrunch.com/2019/11/06/hp-confirms-it-is-having-discussions-with-xerox-about-being-acquired/
21486447,A Mexican General’s Exile in Staten Island Led to Modern Chewing Gum,2019-11-08T20:35:20.000Z,2,0,https://www.atlasobscura.com/articles/who-invented-gum
21486430,Apple has made it difficult to use web-based technology on its platforms,2019-11-08T20:33:33.000Z,491,349,https://onezero.medium.com/apple-is-trying-to-kill-web-technology-a274237c174d
21486417,"Slow in the Application, Fast in SSMS? (2011)",2019-11-08T20:32:47.000Z,1,0,http://www.sommarskog.se/query-plan-mysteries.html
21486407,Tokyo Neapolitan: The New Wave of Japanese Pizza,2019-11-08T20:32:00.000Z,3,0,https://www.eater.com/2017/2/21/14670944/best-pizza-tokyo-guide
21486373,No One Should Buy the Facebook Portal TV,2019-11-08T20:28:29.000Z,3,0,https://www.cnet.com/news/no-one-should-buy-the-facebook-portal-tv/
21486366,CoPower Acquired by Vancity Community Investment Bank,2019-11-08T20:27:58.000Z,1,0,https://copower.me/en/driving-change-together-vcib/
21486326,The false promise of green housing,2019-11-08T20:24:16.000Z,1,0,https://thewalrus.ca/the-false-promise-of-green-housing/
21486315,What principles not to disrupt: on AI and regulation,2019-11-08T20:23:22.000Z,1,0,https://medium.com/@marietje.schaake/what-principles-not-to-disrupt-on-ai-and-regulation-cabbd92fd30e
21486303,Netflix Open-Sources: Mantis,2019-11-08T20:21:48.000Z,1,0,https://netflix.github.io/mantis/
21486289,Ask HN: Doing transactional email (and beyond) in your SaaS product?,2019-11-08T20:20:27.000Z,1,1,
21486278,On Safety Critical Software,2019-11-08T20:19:50.000Z,71,24,https://alexgaynor.net/2019/nov/07/on-safety-critical-software/
21486272,"Open Source, SaaS and Monetization",2019-11-08T20:19:25.000Z,2,0,http://lucumr.pocoo.org/2019/11/4/open-source-and-saas/
21486258,The Deadliest Weapon,2019-11-08T20:17:43.000Z,1,0,https://www.iafrikan.com/2019/11/08/africa-military-ak-47-mikhail-kalashnikov-russia-history/
21486251,Judge Says Police Can Search Company's Entire DNA Database,2019-11-08T20:17:00.000Z,4,0,https://www.huffingtonpost.ca/entry/police-search-dna-database_n_5dc1dc4ee4b08b735d616096
21486237,Why Do We Tolerate Saudi Money in Tech?,2019-11-08T20:15:47.000Z,47,23,https://www.nytimes.com/2019/11/08/opinion/why-do-we-tolerate-saudi-money-in-tech.html
21486209,"GIF site Gfycat announces mass deletions, threatens Archive Team with lawsuit",2019-11-08T20:11:53.000Z,43,8,https://boingboing.net/2019/11/08/gif-site-gfycat-announces-mass.html
21486182,New research synthesizes different aspects of causality in quantum field theory,2019-11-08T20:08:36.000Z,1,0,https://phys.org/news/2019-11-aspects-causality-quantum-field-theory.html
21486161,Code PHP and Python on S60v3 Mobile (2008),2019-11-08T20:06:32.000Z,2,1,https://masteranza.wordpress.com/2008/03/23/code-php-and-python-on-mobile-s60v3/
21486159,A bunch of coding challenges solved in one line of code,2019-11-08T20:06:27.000Z,5,3,https://swiftoneliners.com
21486155,Nan Gates and Flip Flops [video],2019-11-08T20:06:03.000Z,4,0,https://www.youtube.com/watch?v=5TFDG-y-EHs
21486154,Xilinx: FPGA and CPUs and RF to 6 GHz on a Single Chip,2019-11-08T20:05:42.000Z,1,0,https://www.xilinx.com/products/silicon-devices/soc/rfsoc.html
21486140,"Show HN: S3patch – update files on S3 by patching them, not replacing them",2019-11-08T20:03:43.000Z,3,1,https://s3patch.com/
21486128,Ask HN: How to be completely anonymous from the web,2019-11-08T20:03:00.000Z,3,2,
21486124,The Valentine’s Day Text Message Mystery,2019-11-08T20:01:52.000Z,90,46,https://www.nytimes.com/2019/11/08/style/text-message-valentines.html
21486095,Simple Continuous Delivery for GitHub,2019-11-08T19:58:11.000Z,2,0,https://deliverybot.dev/
21486073,Why Constant Learners All Embrace the 5-Hour Rule (2016),2019-11-08T19:55:37.000Z,2,0,https://www.inc.com/empact/why-constant-learners-all-embrace-the-5-hour-rule.html
21486072,The myth of the male bumbler (2017),2019-11-08T19:55:30.000Z,1,0,https://theweek.com/articles/737056/myth-male-bumbler
21486069,Quebec denies Frenchwoman's immigration for failing to show command of French,2019-11-08T19:55:11.000Z,4,0,https://www.theguardian.com/world/2019/nov/08/quebec-denies-frenchwoman-residency-for-failing-to-show-command-of-french
21486042,Liverpool’s Crosby Beach Is a Mile of World War II Blitz Rubble,2019-11-08T19:53:03.000Z,58,20,https://www.atlasobscura.com/articles/liverpool-beach-war-archaeology
21486024,Are you tracking DevOps metrics?,2019-11-08T19:50:37.000Z,2,0,https://deliverybot.dev/2019/11/08/are-you-tracking-devops-metrics/
21486020,Microsoft bet against Intel with its new Surfaces – and lost,2019-11-08T19:50:15.000Z,2,1,https://www.theverge.com/circuitbreaker/2019/11/7/20954044/microsoft-amd-qualcomm-intel-processors-arm-surface-laptop-3-pro-x-future-computers
21486002,Parallel Commits: A New Atomic Commit Protocol for Distributed Transactions,2019-11-08T19:48:38.000Z,175,38,https://www.cockroachlabs.com/blog/parallel-commits
21485978,Power line corridors provide important wildlife habitat,2019-11-08T19:46:06.000Z,1,2,https://cloverly.com/blog/power-line-corridors-provide-wildlife-habitat/
21485976,Intermediate Floating-Point Precision,2019-11-08T19:46:02.000Z,1,0,https://randomascii.wordpress.com/2012/03/21/intermediate-floating-point-precision/
21485962,"IBM, sonic delay lines, and the history of the 80×24 display",2019-11-08T19:44:08.000Z,113,44,http://www.righto.com/2019/11/ibm-sonic-delay-lines-and-history-of.html?m=1
21485913,Online Advertising - The new Dot Com bubble is here!,2019-11-08T19:39:33.000Z,6,2,https://thecorrespondent.com/100/the-new-dot-com-bubble-is-here-its-called-online-advertising
21485893,Apple’s Gadgets Co-Star in Its New TV Drama,2019-11-08T19:37:08.000Z,1,0,https://www.wsj.com/articles/apples-gadgets-co-star-in-its-new-tv-drama-11573145328?mod=rsswn
21485866,Lessons from a Failed SaaS – Building SaaS #37 · Matt Layman,2019-11-08T19:35:00.000Z,2,0,https://www.mattlayman.com/building-saas/failed-saas-lessons/
21485855,"Vaping Illnesses Linked to Vitamin E Acetate, CDC Says",2019-11-08T19:33:43.000Z,7,3,https://www.nytimes.com/2019/11/08/health/vaping-illness-cdc.html
21485842,Charcoal,2019-11-08T19:32:14.000Z,2,0,https://craigmod.com/ridgeline/008/
21485837,What are the differences between private key and public key encryption,2019-11-08T19:31:28.000Z,1,0,https://www.quora.com/What-are-the-differences-between-private-key-and-public-key-encryption/answer/Louis-Metz-1?share=1
21485826,Abe Lincoln Looks West: How the Civil War Changed the Frontier,2019-11-08T19:30:10.000Z,36,14,https://www.laphamsquarterly.org/roundtable/abe-lincoln-looks-west
21485822,The Ten Commandments of Workism,2019-11-08T19:29:43.000Z,8,0,https://www.mcsweeneys.net/articles/the-ten-commandments-of-workism
21485820,‘Joker’ did 15x and becomes the most profitable comic book movie ever,2019-11-08T19:29:37.000Z,1,0,http://www.forbes.com/sites/scottmendelson/2019/11/08/box-office-dc-films-joker-tops-955-million-to-become-more-profitable-than-deadpool-venom-and-batman/
21485809,Hydra Is the First Fuzzing Framework to Find Any File System Bug,2019-11-08T19:28:09.000Z,2,0,https://www.cc.gatech.edu/news/628763/hydra-first-fuzzing-framework-find-any-system-bug
21485783,Why Is Category Theory a Trending Topic?,2019-11-08T19:25:48.000Z,3,0,https://johncarlosbaez.wordpress.com/2019/11/08/why-is-category-theory-a-trending-topic/
21485775,Vitamin E acetate found in all lung fluid samples tested from injured vapers,2019-11-08T19:25:28.000Z,22,2,https://arstechnica.com/science/2019/11/vitamin-e-acetate-found-in-all-lung-fluid-samples-tested-from-injured-vapers/
21485740,The State of the Octoverse,2019-11-08T19:21:41.000Z,1,1,https://octoverse.github.com
21485730,Potential culprit found in vaping-related lung injuries and deaths,2019-11-08T19:20:47.000Z,3,0,https://www.washingtonpost.com/health/2019/11/08/potential-culprit-found-vaping-related-lung-injuries-deaths/
21485720,Our Company Retreat for the End of 2019,2019-11-08T19:18:37.000Z,66,78,https://blog.insent.ai/insent.ai-company-retreat-end-of-2019
21485675,What makes an image memorable? Ask a computer,2019-11-08T19:14:34.000Z,4,0,http://news.mit.edu/2019/what-makes-an-image-memorable-ask-computer-1101
21485656,Ethereum 2 quick update 3,2019-11-08T19:12:58.000Z,2,0,https://blog.ethereum.org/2019/11/08/eth2-quick-update-no-3/
21485655,The cheap sensor detecting landslides in India,2019-11-08T19:12:54.000Z,1,0,https://www.bbc.com/news/world-asia-india-50313344
21485648,Drone-mounted lasers reveal ancient settlement off Florida coast,2019-11-08T19:12:21.000Z,2,0,https://www.theguardian.com/science/2019/nov/04/drone-lasers-ancient-settlement-florida-lidar-archaeology
21485643,Robotic arm slows down to avoid the uncanny valley,2019-11-08T19:12:07.000Z,3,1,https://techcrunch.com/2019/11/07/this-robotic-arm-slows-down-to-avoid-the-uncanny-valley/
21485639,Why does WhatsApp provide end-to-end encryption while others don't?,2019-11-08T19:11:53.000Z,1,0,https://www.quora.com/Why-does-WhatsApp-provide-end-to-end-encryption-while-others-dont/answer/Louis-Metz-1?share=1
21485633,"GitHub tops 40M developers as Python, data science, ML popularity surges",2019-11-08T19:11:34.000Z,2,0,https://www.zdnet.com/article/github-tops-40-million-developers-as-python-data-science-machine-learning-popularity-surges/
21485630,How big tech is dragging us towards the next financial crash,2019-11-08T19:11:17.000Z,6,2,https://www.theguardian.com/business/2019/nov/08/how-big-tech-is-dragging-us-towards-the-next-financial-crash
21485619,Google’s new chip design protects the cloud where it’s most vulnerable,2019-11-08T19:10:42.000Z,1,0,https://www.technologyreview.com/s/614675/googles-new-chip-protects-the-cloud-where-its-most-vulnerable/
21485602,The Carbon Bomb,2019-11-08T19:09:13.000Z,5,0,https://blogs.scientificamerican.com/observations/the-carbon-bomb/
21485595,Rich Residents Build Defenses Against Rising Seas; Poor Ones Leave,2019-11-08T19:08:08.000Z,18,8,https://www.scientificamerican.com/article/rich-residents-build-defenses-against-rising-seas-poor-ones-leave1/
21485594,"Big Data, Big Decisions: Finding the Right Technology for Interactive Analytics",2019-11-08T19:08:08.000Z,3,0,https://engineering.salesforce.com/big-data-big-decisions-690a00fad88d
21485592,Fixing Random: pigeons and the noisy-or distribution,2019-11-08T19:08:04.000Z,3,0,https://ericlippert.com/2019/11/08/fixing-random-bonus-episode-2-pigeons-and-the-noisy-or-distribution/
21485575,Reviving a 19 Year Old Test to See If an Employer Is Worth Working For,2019-11-08T19:06:48.000Z,8,6,https://alcamine.com/blog/reviving-a-19-year-old-test-to-see-if-an-employer-is-worth-working-for
21485574,AMD Announces 3rd Gen Ryzen Threadripper,2019-11-08T19:06:41.000Z,5,0,https://fuse.wikichip.org/news/2938/amd-announces-3rd-gen-ryzen-threadripper/
21485567,Compiling a Functional Language Using C++,2019-11-08T19:05:51.000Z,1,0,https://danilafe.com/blog/00_compiler_intro/
21485563,Members of violent white supremacist website exposed in data dump,2019-11-08T19:05:34.000Z,1,0,https://arstechnica.com/information-technology/2019/11/massive-data-dump-exposes-members-of-website-for-violent-white-supremacists/
21485544,17th century warships linked to Sweden's historic Vasa found,2019-11-08T19:03:46.000Z,1,0,https://www.theguardian.com/world/2019/nov/08/17th-century-warships-linked-to-swedens-historic-vasa-found
21485542,Going Bare Metal and Multi-Cloud with Kubernetes,2019-11-08T19:03:32.000Z,2,0,https://vmblog.com/archive/2019/11/06/going-bare-metal-and-multi-cloud-with-kubernetes.aspx#.XcW77JJKjOQ
21485538,Seeing What a GAN Cannot Generate,2019-11-08T19:03:17.000Z,19,0,http://ganseeing.csail.mit.edu
21485536,Serving on a board will make you a better leader,2019-11-08T19:02:58.000Z,2,0,https://medium.com/@keith_harper/serving-on-a-board-will-make-you-a-better-leader-2d863c1f9091
21485533,Why USB Flash Drives Are Still Relevant,2019-11-08T19:02:24.000Z,2,0,https://www.mediafast.com/why-usb-flash-drives-are-still-relevant/
21485518,Why are so many data-savvy companies buying into Facebook Workplace?,2019-11-08T19:01:08.000Z,2,0,https://www.thedrum.com/news/2019/11/08/why-are-so-many-data-savvy-companies-buying-facebook-workplace
21485510,Dark Mode in 1 Step,2019-11-08T19:00:49.000Z,1,0,https://blog.usmanity.com/dark-mode-in-1-step/
21485508,Fire Piston,2019-11-08T19:00:37.000Z,2,0,https://en.wikipedia.org/wiki/Fire_piston
21485498,Pascal's Wager,2019-11-08T19:00:00.000Z,1,0,https://en.wikipedia.org/wiki/Pascal%27s_wager
21485490,Facebook document leak gives ammunition to investigators,2019-11-08T18:59:03.000Z,19,0,https://arstechnica.com/tech-policy/2019/11/facebook-sold-competition-quashing-as-a-privacy-move-leaked-documents-show/
21485478,My Enemy the Minimap,2019-11-08T18:58:23.000Z,4,1,https://ericasadun.com/2019/11/08/my-enemy-the-minimap/
21485463,WeWork’s Workers Are Organizing,2019-11-08T18:56:42.000Z,3,0,https://www.theverge.com/2019/11/8/20955103/wework-coalition-softbank-restructuring-adam-neumann-organizing-letter
21485437,The future of the US workforce depends on a higher education worth paying for,2019-11-08T18:53:39.000Z,5,0,https://www.cnbc.com/2019/11/08/forget-free-college-workforce-depends-on-education-worth-paying-for.html
21485422,Unusual coyotes on Galveston Island descended from a rare wolf species,2019-11-08T18:51:41.000Z,2,0,https://www.theatlantic.com/science/archive/2019/11/the-ghost-genes-of-a-nearly-extinct-animal-live-on-in-texas/601624/
21485416,Facebook's ban of animal sales affects unpopular but healthy breeds,2019-11-08T18:50:21.000Z,1,0,https://pipcomix.tumblr.com/post/188893209090/congrats-to-the-aras-who-got-facebook-to-ban
21485411,AI Copernicus ‘Discovers’ That Earth Orbits the Sun,2019-11-08T18:49:45.000Z,2,0,https://www.nature.com/articles/d41586-019-03332-7
21485369,They will ask and receive–and then lash and maul a while and then do the needful,2019-11-08T18:44:38.000Z,1,0,https://founders.archives.gov/documents/Adams/04-11-02-0113
21485368,Cipher Agility Considered Harmful,2019-11-08T18:44:32.000Z,1,0,https://paragonie.com/blog/2019/10/against-agility-in-cryptography-protocols
21485353,Let's Create a Blockchain in Go,2019-11-08T18:43:22.000Z,3,0,http://blog.hexaluna.net/lets-create-a-blockchain-in-go-part-1.html
21485344,Adversarial Fisher Vectors for Unsupervised Representation Learning,2019-11-08T18:42:34.000Z,3,0,https://github.com/apple/ml-afv
21485315,Ask HN: What advice do you have for your younger you?,2019-11-08T18:40:39.000Z,2,4,
21485295,Systemd needs official documentation on best practices,2019-11-08T18:38:27.000Z,59,57,https://utcc.utoronto.ca/~cks/space/blog/linux/SystemdNeedsBestPractices
21485278,stdout Buffering,2019-11-08T18:37:14.000Z,2,0,https://eklitzke.org/stdout-buffering
21485265,Phones and PCS sold in Russia will have to come pre-installed with Russian apps,2019-11-08T18:36:16.000Z,1,0,https://www.zdnet.com/article/phones-and-pcs-sold-in-russia-will-have-to-come-pre-installed-with-russian-apps/
21485260,Myths of the System: Radical Guide to the Unworld Entire,2019-11-08T18:35:56.000Z,1,0,https://archive.org/details/33MythsOfTheSystemDarrenAllen_201812
21485245,Show HN: Opsopi An open-source price comparison extension,2019-11-08T18:33:58.000Z,3,0,
21485232,Using EBPF Programs to Profile Zuul CI Builds,2019-11-08T18:32:26.000Z,2,0,https://www.softwarefactory-project.io/using-ebpf-programs-to-profile-zuul-ci-builds.html
21485213,Popular Android phones can be tricked into snooping on their owners,2019-11-08T18:30:57.000Z,2,0,https://techcrunch.com/2019/11/08/android-baseband-flaws/
21485186,Getting Started with Machine Learning on MCUs with TensorFlow,2019-11-08T18:28:22.000Z,2,0,https://blog.particle.io/2019/11/08/particle-machine-learning-101/
21485174,Fannie Mae Accidentally Spills the Beans on the Impending Housing Market Crash,2019-11-08T18:27:05.000Z,3,0,https://www.ccn.com/fannie-mae-housing-market-crash/
21485120,Lots of NPM v7 Updates,2019-11-08T18:22:59.000Z,3,0,https://blog.npmjs.org/post/188841555980/updates-to-community-docs-more
21485112,A compiler and virutal machine in a few lines,2019-11-08T18:22:22.000Z,1,1,https://github.com/zakirullin/tiny-compiler
21485098,Investigators Find Clue to Mysterious Vaping Injuries,2019-11-08T18:20:54.000Z,3,2,https://www.wsj.com/articles/investigators-find-clue-to-mysterious-vaping-injuries-11573236635?mod=rsswn
21485087,Show HN: FOS – Web components to turn your web app into a fake OS,2019-11-08T18:19:50.000Z,2,1,https://github.com/victorqribeiro/fos
21485071,Google and Twitter Approved Our BS Anti-Vaxx Ads,2019-11-08T18:17:57.000Z,2,0,https://www.thedailybeast.com/you-wont-believe-how-easy-it-is-to-buy-anti-vaxx-ads-on-google-and-twitter
