objectID,title,created_at,points,num_comments,url
21489783,The best alternatives to Apple’s disastrous MacBooks,2019-11-09T05:20:41.000Z,3,1,https://www.cultofmac.com/664528/best-macbook-alternatives/
21489777,Archimedes – LaTeX and Markdown Editor for Mac,2019-11-09T05:18:52.000Z,2,0,https://archimedesapp.com
21489748,Ask HN: How many vetted users does Hacker News have now?,2019-11-09T05:11:04.000Z,12,5,
21489741,The fusion energy dream is inching toward planet-saving reality,2019-11-09T05:07:10.000Z,4,0,https://www.washingtonpost.com/opinions/2019/11/08/fusion-energy-dream-is-inching-toward-planet-saving-reality/
21489738,Instant Builds,2019-11-09T05:06:52.000Z,2,0,https://blog.metaobject.com/2019/11/instant-builds.html
21489722,How to unit-test a java function which take sample JSONObject as input?,2019-11-09T05:00:46.000Z,1,0,https://stackoverflow.com/questions/58776498/what-all-unit-test-cases-should-i-write-for-following-function-also-how-to-pr
21489711,US officials identify 'strong culprit' in vaping illnesses,2019-11-09T04:57:13.000Z,3,0,https://apnews.com/80fe373103cf4096b4567cf5717380cf
21489701,For Founders: The Feature Death Trap,2019-11-09T04:53:51.000Z,6,0,https://medium.com/hackernoon/its-not-a-feature-problem-avoiding-startup-tarpits-7d5ec4b8c81b
21489686,WebKit Goals for 2020,2019-11-09T04:47:09.000Z,160,141,https://trac.webkit.org/wiki/WebKitGoalsfor2020
21489651,Building a keyboard from an old typewriter,2019-11-09T04:38:07.000Z,30,7,http://cowlark.com/2019-11-03-keyboard/
21489645,Ask HN: How did Google know I clicked SiriusXM in my car?,2019-11-09T04:37:05.000Z,2,2,
21489630,.NET Core with Jupyter Notebooks – Available Today – Preview 1,2019-11-09T04:31:20.000Z,1,0,https://devblogs.microsoft.com/dotnet/net-core-with-juypter-notebooks-is-here-preview-1/
21489604,WeWork's Adam Neumann sued over $1.7bn package,2019-11-09T04:26:59.000Z,5,0,https://www.bbc.co.uk/news/business-50351834
21489584,Reddit Datasets for Machine Learning,2019-11-09T04:23:24.000Z,2,0,https://lionbridge.ai/datasets/top-10-reddit-datasets-for-machine-learning/
21489572,Modern genetics will improve health and usher in “designer” children,2019-11-09T04:21:09.000Z,1,1,https://www.economist.com/science-and-technology/2019/11/07/modern-genetics-will-improve-health-and-usher-in-designer-children
21489570,Hard Times for SoftBank,2019-11-09T04:20:23.000Z,1,0,https://www.economist.com/business/2019/11/07/hard-times-for-softbank
21489568,TikTok time-bomb: Silly clips raise some serious questions,2019-11-09T04:19:40.000Z,2,0,https://www.economist.com/business/2019/11/07/tiktoks-silly-clips-raise-some-serious-questions
21489539,Ask HN: What are the best resources for learning modern 3D graphics?,2019-11-09T04:12:52.000Z,63,13,
21489492,Brains Create Identical Objects,2019-11-09T04:00:01.000Z,3,0,https://www.scaruffi.com/phi/syn220.html
21489469,Ask HN: Why aren't more companies source code leaked?,2019-11-09T03:55:51.000Z,1,1,
21489456,One year of Sensu Go – and licensing change,2019-11-09T03:52:13.000Z,1,0,https://blog.sensu.io/one-year-of-sensu-go
21489446,Experiences and Suggestions: Manufacturing in China,2019-11-09T03:49:46.000Z,1,0,https://www.makerfabs.cc/article/experiences-suggestions-manufacturing-in-china.html
21489445,Delays in Emergency Care and Mortality During Major U.S. Marathons,2019-11-09T03:49:44.000Z,39,55,https://www.nejm.org/doi/full/10.1056/NEJMsa1614073
21489439,Voicen Linear 4 Mic Array Kit- Open Source Smart Speaker,2019-11-09T03:48:21.000Z,2,0,https://www.makerfabs.com/voicen-linear-4-mic-array-kit.html
21489432,Incorporating Machine Learning into iOS Apps,2019-11-09T03:45:46.000Z,2,0,https://heartbeat.fritz.ai/incorporating-machine-learning-into-ios-apps-a5eb8bccd915
21489420,What Is Mastodon?,2019-11-09T03:41:41.000Z,3,0,
21489393,This isn't your father's Microsoft,2019-11-09T03:34:35.000Z,68,84,http://sawers.com/blog/this-isnt-your-fathers-microsoft/
21489376,Where were today's leaders in 1989?,2019-11-09T03:27:59.000Z,1,0,https://www.gzeromedia.com/where-were-todays-leaders-in-1989
21489361,Handmade Tabletop Dice Project Raises $1.8M on First Day,2019-11-09T03:24:07.000Z,3,0,https://www.kickstarter.com/projects/dispeldice/dispel-dice
21489338,"Turn web apps into lightweight native apps, no electron",2019-11-09T03:15:49.000Z,23,7,https://github.com/SiDevesh/Quark-Carlo
21489333,Potential vs. Delivery,2019-11-09T03:13:16.000Z,1,0,https://letterstoanewdeveloper.com/2018/11/05/potential-vs-delivery/
21489331,Facebook is deleting the name of the potential whistleblower,2019-11-09T03:11:51.000Z,12,5,https://apnews.com/ad8f2a9b6e424138afcc97fcf2eb29bf
21489327,Study: Ants are “immune” to traffic jams,2019-11-09T03:11:05.000Z,2,0,https://arstechnica.com/science/2019/10/study-ants-are-immune-to-traffic-jams/
21489300,BuzzFeed article accidentally shows WiFi password in subheading,2019-11-09T03:03:30.000Z,2,0,https://www.buzzfeed.com/mjs538/things-boomers-absolutely-love-that-most-millennials
21489296,I put Paul Graham's essays in audio format in Spotify,2019-11-09T03:02:59.000Z,2,3,https://open.spotify.com/show/2smzwGQq7QMJFvFLpv4Aok
21489273,Stroke of Insight (2008),2019-11-09T02:58:30.000Z,2,0,https://www.ted.com/talks/jill_bolte_taylor_s_powerful_stroke_of_insight?language=en
21489259,The Power of Checklists,2019-11-09T02:55:23.000Z,3,1,https://www.transposit.com/blog/2019.11.08-the-power-of-checklists/
21489230,Instagram to Start Hiding Like Counts in the U.S.,2019-11-09T02:47:03.000Z,1,0,https://variety.com/2019/digital/news/instagram-likes-like-counts-hidden-1203399222/
21489228,Second-System Effect,2019-11-09T02:46:50.000Z,3,0,https://en.wikipedia.org/wiki/Second_system_effect
21489223,The Princess and the Pea,2019-11-09T02:45:55.000Z,1,0,https://www.kevinlondon.com/2019/11/08/princess-and-the-pea.html
21489222,Exploring Wealth Inequality,2019-11-09T02:45:32.000Z,5,0,https://www.cato.org/publications/policy-analysis/exploring-wealth-inequality
21489218,Chronicle is Dead and Google killed it,2019-11-09T02:45:09.000Z,13,1,https://www.vice.com/en_us/article/9kej3e/chronicle-is-dead-and-google-killed-it
21489217,DuckDuckGo Privacy Essentials for Safari,2019-11-09T02:44:28.000Z,1,0,https://spreadprivacy.com/duckduckgo-for-safari/
21489208,Deprecations and Removals in Chrome 78,2019-11-09T02:43:16.000Z,2,0,https://developers.google.com/web/updates/2019/10/chrome-79-deps-rems
21489188,Print CSS basics in 10 minutes,2019-11-09T02:36:21.000Z,6,0,https://www.paperplane.app/blog/print-css-basics/
21489187,Is Snap stealing our feelings?,2019-11-09T02:36:00.000Z,1,0,https://foundation.mozilla.org/en/campaigns/snapchat-stop-stealing-our-feelings/
21489159,Show HN: Community for freelancers to connect and learn from each other,2019-11-09T02:29:10.000Z,3,0,https://lancerlist.co/community
21489143,DY3x – The 140-year-old man? (Fiction),2019-11-09T02:24:38.000Z,1,0,https://medium.com/jp-fostersons-fiction-etc/dy3x-2dd4315adf2f
21489132,"The Laser Weapon Is Really, Really Finally Here",2019-11-09T02:21:37.000Z,2,0,https://foxtrotalpha.jalopnik.com/the-laser-weapon-is-really-really-finally-here-1839639499
21489129,"Sudden oak death spreading fast, California’s coastal forests facing devastation",2019-11-09T02:21:23.000Z,2,0,https://www.sfchronicle.com/environment/article/Sudden-oak-death-spreading-fast-California-s-14815683.php
21489126,12-centimeter Sparganosis worm removed from human patient,2019-11-09T02:21:05.000Z,1,0,https://www.fox35orlando.com/news/man-has-12-centimeter-parasitic-worm-removed-from-brain-after-years-of-numbness-blackouts
21489099,Failure Is Not an Option: The Four-Inch Flight,2019-11-09T02:14:35.000Z,2,0,http://movies2.nytimes.com/books/first/k/kranz-failure.html
21489053,How PHP Works Internally,2019-11-09T02:04:54.000Z,2,0,https://thephp.website/en/issue/how-does-php-engine-actually-work/
21489037,C# Code Quality – Part 1,2019-11-09T02:00:16.000Z,1,0,https://christianfindlay.com/2019/11/08/c-code-quality-part-1/
21489022,How the movies and television are made,2019-11-09T01:57:00.000Z,3,0,
21489016,"Instagram to test hiding Like counts in US, which could hurt influencers",2019-11-09T01:55:09.000Z,1,0,https://techcrunch.com/2019/11/08/instagram-hide-likes-us/
21488971,‘AI will change human consciousness beyond the Enlightenment’: Kissinger,2019-11-09T01:46:31.000Z,3,0,https://sociable.co/technology/google-is-a-threat-to-civilization-and-eric-schmidt-is-one-of-my-best-friends-henry-kissinger/
21488963,Vape lung ‘breakthrough’: culprit in THC products could be vitamin E acetate,2019-11-09T01:45:16.000Z,3,0,https://techcrunch.com/2019/11/08/vape-lung-breakthrough-suggests-lethal-culprit-in-thc-products-could-be-vitamin-e-acetate/
21488935,Ambrosia Quietly Back in Business,2019-11-09T01:38:40.000Z,1,0,https://onezero.medium.com/exclusive-ambrosia-the-young-blood-transfusion-startup-is-quietly-back-in-business-ee2b7494b417
21488914,DirectX Raytracing (DXR) Tier 1.1,2019-11-09T01:34:33.000Z,2,0,https://devblogs.microsoft.com/directx/dxr-1-1/
21488905,NATS – Open-Source Messaging System,2019-11-09T01:33:39.000Z,4,0,https://nats.io/
21488864,Public-Key Cryptosystems and Digital Signatures,2019-11-09T01:24:43.000Z,2,0,https://leimao.github.io/blog/Public-Key-Cryptosystem-and-Digital-Signature/
21488840,Can I sell my instagram handle?,2019-11-09T01:21:35.000Z,4,4,
21488828,NASA's 'Hidden Figures' to Be Awarded Congressional Gold Medals,2019-11-09T01:19:37.000Z,1,0,http://www.collectspace.com/news/news-110819a-hidden-figures-congressional-gold-medal.html
21488812,Instagram will test hiding likes in the US as soon as next week,2019-11-09T01:16:26.000Z,5,1,https://www.theverge.com/2019/11/8/20956091/instagram-testing-hiding-likes-us-bullying-mosseri
21488804,"The Important Thing, that is powerful enough to override all your deficiencies?",2019-11-09T01:15:17.000Z,1,0,https://blog.asmartbear.com/whats-the-important-thing-that-is-powerful-enough-to-override-all-your-deficiencies.html
21488797,Allegations of Sexism with Apple Card,2019-11-09T01:14:17.000Z,10,2,https://twitter.com/dhh/status/1192540900393705474
21488793,What Will Happen When We Decide Computers Are Just Devices to Access the Cloud?,2019-11-09T01:13:40.000Z,1,1,https://cheapskatesguide.org/articles/cloud-computing.html
21488786,Sweet Home Alabama Played on Tesla Coils (2012),2019-11-09T01:13:08.000Z,32,10,http://www.openculture.com/2012/03/sweet_home_alabama_played_on_tesla_coils.html
21488768,StickyBoard: Fully Customizable Web Admin/Dashboard Solution Based on React,2019-11-09T01:10:11.000Z,3,0,https://github.com/soaple/stickyboard
21488765,StickyBoard,2019-11-09T01:09:30.000Z,1,0,http://stickyboard.co.kr/
21488751,"Bye, Chrome: Why I’m switching to Firefox (2018)",2019-11-09T01:06:18.000Z,310,165,https://www.fastcompany.com/90174010/bye-chrome-why-im-switching-to-firefox-and-you-should-too
21488746,I Test in Prod,2019-11-09T01:05:34.000Z,1,0,https://increment.com/testing/i-test-in-production/
21488743,Cloud migrating production first in 12 hours or less,2019-11-09T01:05:12.000Z,3,7,
21488741,Amazonia 1952: Found (2012),2019-11-09T01:05:00.000Z,6,0,"http://theappendix.net/issues/2012/12/field-notes,-amazonia-1952:-found"
21488727,We are living in Hideo Kojima's dystopian nightmare,2019-11-09T01:03:25.000Z,3,0,https://www.washingtonpost.com/video-games/2019/11/08/we-are-living-hideo-kojimas-dystopian-nightmare-can-he-save-us/
21488697,A Wearable Wiretap: A new generation of ankle monitors raises thorny questions,2019-11-09T00:58:04.000Z,7,0,https://slate.com/technology/2019/11/enhanced-ankle-monitors-community-supervision-privacy.html
21488671,A Prisoner Who Briefly Died Argues That He’s Served His Life Sentence,2019-11-09T00:54:08.000Z,5,0,https://www.nytimes.com/2019/11/08/us/prisoner-dies-life-sentence.html
21488660,"Prettier v1.19: TypeScript 3.7, long awaited Vue option, and more",2019-11-09T00:52:54.000Z,1,0,https://prettier.io/blog/2019/11/09/1.19.0.html
21488657,Counterterrorism Official: U.S. seen as 'exporter of white supremacist ideology',2019-11-09T00:52:29.000Z,1,0,https://news.yahoo.com/america-seen-as-exporter-of-white-supremacist-ideology-says-us-counterterrorism-official-232420985.html
21488655,10M pot plants worth $1B destroyed in Kern County,2019-11-09T00:52:17.000Z,1,1,https://www.latimes.com/california/story/2019-11-04/authorities-destroy-10-million-plants-marijuana-hemp
21488645,Ask HN: Any activites in Bay Area? Except work-bar-sleep?,2019-11-09T00:50:58.000Z,2,1,
21488610,Gitlab director resigns over “retaliatory behavior”,2019-11-09T00:46:55.000Z,2,0,https://www.businessinsider.com/gitlab-director-resigns-retaliatory-behavior-2019-11
21488531,Ask HN: How to get started in embedded industrial software?,2019-11-09T00:34:41.000Z,2,1,
21488524,Every Programming Tutorial,2019-11-09T00:33:17.000Z,4,0,https://www.youtube.com/watch?v=oJs4E3cAweU
21488521,Familiar with frantittles or spindleshanks? Researchers want to hear from you,2019-11-09T00:32:59.000Z,1,0,https://www.itv.com/news/2019-11-09/familiar-with-frantittles-or-spindleshanks-researchers-want-to-hear-from-you/
21488511,Hermeneutics,2019-11-09T00:31:09.000Z,2,0,https://en.wikipedia.org/wiki/Hermeneutics
21488491,The Great Jefferson Taboo (1972),2019-11-09T00:27:47.000Z,1,0,https://www.americanheritage.com/great-jefferson-taboo
21488478,My_first_calculator.py,2019-11-09T00:25:24.000Z,4,0,https://github.com/AceLewis/my_first_calculator.py/blob/master/my_first_calculator.py
21488477,Young Homebuyers Are Vanishing from the U.S.,2019-11-09T00:25:16.000Z,1,0,https://www.investors.com/news/home-young-us-rits-older/
21488474,The Sudafed Solution to America's Vaping Problem,2019-11-09T00:24:40.000Z,1,0,https://www.bloomberg.com/opinion/articles/2019-11-06/the-sudafed-solution-to-america-s-vaping-problem
21488462,Running a database written in go in the browser,2019-11-09T00:22:25.000Z,2,0,https://pingcap.com/blog/tidb-in-the-browser-running-a-golang-database-on-webassembly/
21488449,Mr Bean: how to get started in UX/UI design?,2019-11-09T00:20:38.000Z,1,0,https://obytes.com/blog/2019/ux-ui-design-how-to-get-started/
21488438,Google Play AudioBooks Are Not Hampered with DRM,2019-11-09T00:18:17.000Z,1,0,https://the-digital-reader.com/2018/07/23/how-to-download-audiobooks-from-google-play-books-drm-free/
21488436,Rise in Poor Millennial Health Expected to Have Long-Term Economic Consequences,2019-11-09T00:17:58.000Z,2,1,https://curated.tncontentexchange.com/states/illinois/rise-in-poor-millennial-health-expected-to-have-severe-long/article_43428cc1-dfb4-56bd-a5c4-d7afb092c05b.html
21488420,"Don't Name Internal Systems, Sites, or Applications After Org Codes",2019-11-09T00:14:58.000Z,2,0,https://www.mergeyourdata.com/blogs/mergeyourdata-com/dont-name-sites-or-apps-after-org-codes
21488416,Company accused of selling Chinese-made security equipment to U.S. military,2019-11-09T00:14:25.000Z,4,0,https://www.cbsnews.com/news/new-york-company-aventura-technologies-accused-of-selling-chinese-made-security-equipment-to-us-military/
21488415,How Swift Achieved Dynamic Linking Where Rust Couldn't,2019-11-09T00:14:16.000Z,278,153,https://gankra.github.io/blah/swift-abi/
21488411,"DNS-over-HTTPS will roll out in all major browsers, despite ISP opposition",2019-11-09T00:13:46.000Z,4,0,https://www.zdnet.com/article/dns-over-https-will-eventually-roll-out-in-all-major-browsers-despite-isp-opposition/
21488408,How China infiltrates colleges across the globe,2019-11-09T00:13:11.000Z,22,1,https://www.asiatimes.com/2019/11/article/how-china-infiltrates-universities-across-the-globe/
21488379,What Makes Science Trustworthy,2019-11-09T00:08:33.000Z,1,0,http://bostonreview.net/science-nature-philosophy-religion/philip-kitcher-what-makes-science-trustworthy
21488376,What Is Minimum Viable Product? [video],2019-11-09T00:07:39.000Z,2,0,https://www.youtube.com/watch?v=fu1gbTMNe6k
21488336,"Ask HN: Which app that shouldn't use Electron.js, yet it is?",2019-11-09T00:03:37.000Z,15,9,
21488334,Alex MacCaw: Advice to my younger self,2019-11-09T00:03:25.000Z,3,0,https://blog.alexmaccaw.com/advice-to-my-younger-self
21488319,WeWork to divest all non-core businesses,2019-11-09T00:00:50.000Z,2,0,https://www.reuters.com/article/us-wework-restructuring-idUSKBN1XI2IY
21488310,"Tempered CEO Announces Airwall, the IIoT Firewall",2019-11-09T00:00:05.000Z,1,0,https://www.youtube.com/watch?v=ym8nPdS5pSk
21488284,Brazilian Judge Orders Release of Former President Lula Da Silva,2019-11-08T23:56:05.000Z,11,7,https://apnews.com/488f3c1cb3dc48e7ad018580faf95feb
21488282,We Now Have Direct Evidence That Vitamin E Is Behind Vaping Illness Outbreak,2019-11-08T23:55:53.000Z,2,0,https://gizmodo.com/we-now-have-direct-evidence-that-vitamin-e-is-behind-va-1839727371
21488270,Why we are all losing sleep,2019-11-08T23:54:51.000Z,2,0,https://www.newstatesman.com/24-7-jonathan-crary-somerset-house-losing-sleep-review
21488258,"Wildly Popular Japanese Manga Storms U.S., with Wine in Tow",2019-11-08T23:54:14.000Z,2,1,https://www.bloomberg.com/news/articles/2019-10-30/drops-of-god-manga-gets-amazon-english-translation-wine-club
21488233,Most Hackers Aren’t Criminals,2019-11-08T23:52:11.000Z,6,1,https://www.nytimes.com/2019/11/07/opinion/hackers-hacking.html
21488232,DOJ issues warning to big tech: Data and privacy could be competition concerns,2019-11-08T23:52:04.000Z,1,0,https://www.washingtonpost.com/technology/2019/11/08/doj-issues-latest-warning-big-tech-data-privacy-could-be-competition-concerns/
21488197,Why I Decided to Start Blogging,2019-11-08T23:48:16.000Z,3,1,https://sergey.blog/why-i-decided-to-start-blogging
21488179,Kremlin Piles Pressure on Apple,2019-11-08T23:46:49.000Z,2,0,https://thebell.io/en/kremlin-piles-pressure-on-apple/
21488160,Product Focus vs. Customer Focus,2019-11-08T23:43:51.000Z,2,0,https://medium.com/better-marketing/what-business-are-you-really-in-14b7168d7b6b
21488148,"If People Were Paid by Ability, Inequality Would Plummet",2019-11-08T23:42:01.000Z,10,0,https://www.nytimes.com/2019/11/08/upshot/inequality-paying-by-ability.html
21488141,Thank You Telefuel’s Product Hunt Launch Recap,2019-11-08T23:41:28.000Z,1,0,https://www.telefuel.com/blog/product-hunt-launch-recap
21488135,SASE is doing to security what storage devices did to IT,2019-11-08T23:40:38.000Z,1,0,https://perimeters81.com/gartner-sase-transforming-network-securities
21488129,One-Click Formal Methods [pdf],2019-11-08T23:39:57.000Z,1,0,http://www0.cs.ucl.ac.uk/staff/b.cook/oneclick.pdf
21488126,Looks like Valve could be set to launch something called Steam Cloud Gaming,2019-11-08T23:39:44.000Z,1,0,https://www.gamingonlinux.com/articles/looks-like-valve-could-be-set-to-launch-something-called-steam-cloud-gaming.15354
21488101,Brazilian Digital Onboarding Startup Idwall Lands $10M Series B,2019-11-08T23:35:44.000Z,1,0,https://news.crunchbase.com/news/brazilian-digital-onboarding-startup-idwall-lands-10m-series-b-with-qualcomm-as-lead/
21488096,"Awaiting Layoffs, WeWork Employees Say Founder’s Payout Is ‘Graft’",2019-11-08T23:35:29.000Z,5,1,https://www.nytimes.com/2019/11/08/business/wework-employees-letter.html
21488077,My Linux Story: Learning Linux in the 90s,2019-11-08T23:33:11.000Z,3,0,https://opensource.com/article/19/11/learning-linux-90s
21488038,Visual6502 Remix,2019-11-08T23:28:57.000Z,201,34,https://floooh.github.io/visual6502remix/
21488034,Robinhood users are gravitating towards loss-making companies,2019-11-08T23:28:15.000Z,3,0,https://thenextweb.com/insider/2019/11/07/robinhood-users-are-gravitating-towards-loss-making-companies/
21488031,McKinsey Faces Criminal Inquiry over Bankruptcy Case Conduct,2019-11-08T23:28:02.000Z,3,0,https://www.nytimes.com/2019/11/08/business/mckinsey-criminal-investigation-bankruptcy.html
21488030,Configuring DNS-over-HTTPS on Pi-Hole,2019-11-08T23:27:55.000Z,3,0,https://docs.pi-hole.net/guides/dns-over-https/
21488024,Public Investors Signal It’s a Buyer’s Market for Money-Losing Startups,2019-11-08T23:27:40.000Z,1,0,https://news.crunchbase.com/news/public-investors-signal-its-a-buyers-market-for-money-losing-startups/
21488011,Researchers didn't think humans attacked woolly mammoths until uncovered a trap,2019-11-08T23:26:09.000Z,1,0,https://eu.usatoday.com/story/news/world/2019/11/08/woolly-mammoth-bones-found-mexico-shed-light-hunting-ritual/2529632001/
21488001,The Story of the Huge Chunk of Cheese That Sat in the White House for a Year,2019-11-08T23:24:53.000Z,19,3,https://www.foodandwine.com/fwx/food/real-story-huge-chunk-cheese-sat-white-house-year
21487955,Comparison of Soviet and VOA Radio Propaganda [pdf],2019-11-08T23:19:19.000Z,2,0,https://www.cia.gov/library/readingroom/docs/CIA-RDP80-00809A000500730210-4.pdf
21487946,"Developers love tools, how about one for shopping? Please check out Mergie",2019-11-08T23:17:52.000Z,2,1,https://mergie.co/
21487945,Read the CIA’s 1951 Listicle Comparing U.S. and Soviet Propaganda,2019-11-08T23:17:50.000Z,2,0,https://www.muckrock.com/news/archives/2017/jun/30/cia-us-and-soviet-propaganda/
21487910,Eating bone marrow played a key role in the evolution of the human hand (2018),2019-11-08T23:13:15.000Z,2,0,https://www.sciencedaily.com/releases/2018/07/180711105725.htm
21487903,The Measure of Intelligence,2019-11-08T23:12:43.000Z,1,0,https://arxiv.org/abs/1911.01547
21487901,The impact of negative interest rates on banks and firms,2019-11-08T23:12:32.000Z,1,0,https://voxeu.org/article/impact-negative-interest-rates-banks-and-firms
21487892,Apple Mail Stores Encrypted Emails in Plain Text Database,2019-11-08T23:11:37.000Z,2,0,https://medium.com/@boberito/apple-mail-stores-encrypted-emails-in-plain-text-database-fix-included-3c2369ce26d4
21487888,Nothing Matters,2019-11-08T23:11:05.000Z,59,80,https://blog.alexmaccaw.com/nothing-matters
21487854,OpenWrt community is proud to announce the first release candidate of 19.07,2019-11-08T23:06:15.000Z,11,1,
21487846,I’m not scared of robots rebelling. I’m scared because they won’t,2019-11-08T23:04:46.000Z,2,0,https://theprepared.com/blog/im-not-scared-of-the-robots-rebelling-im-scared-because-they-wont/
21487835,Using GitRoyalty to fund my nearly abandoned 2.6k star Open Source project,2019-11-08T23:03:02.000Z,11,0,https://medium.com/@sdrzn/using-gitroyalty-to-fund-my-nearly-abandoned-2-6k-star-open-source-project-364cf68f05da
21487834,100000 Emails from iCloud,2019-11-08T23:02:48.000Z,1,1,https://twitter.com/nealrogers/status/1191931423407501312
21487778,Deep Ecology,2019-11-08T22:55:10.000Z,1,0,https://en.wikipedia.org/wiki/Deep_ecology
21487769,Do Chimpanzees help each other?,2019-11-08T22:53:17.000Z,1,0,https://medium.com/discourse/do-chimpanzees-help-each-other-f65c9bcee00d
21487765,Salt the Pass,2019-11-08T22:52:35.000Z,4,0,https://saltthepass.com/
21487761,"U.S. military unknowingly bought Chinese surveillance tech, prosecutors say",2019-11-08T22:52:24.000Z,3,0,https://www.axios.com/chinese-surveillance-tech-us-military-4d3cf70f-5410-4df9-b007-8e89243a47d1.html
21487748,CTF Field Guide,2019-11-08T22:50:52.000Z,1,0,https://trailofbits.github.io/ctf/
21487741,Show HN: JMBL – Delightful jumbled word puzzles (iOS),2019-11-08T22:50:01.000Z,1,0,https://apps.apple.com/us/app/jmbl-word-puzzle-game/id1248738929?ls=1
21487732,We have removed our product from the Facebook Audience Network,2019-11-08T22:48:19.000Z,6,1,https://www.coin.space/weve-stopped-showing-ads-to-protect-user-privacy/
21487705,JavaScript Party 101: We Should Rebrand JavaScript. Yep? Nope?,2019-11-08T22:43:46.000Z,1,0,https://changelog.com/jsparty/101
21487677,Why Everyone Working in DevOps Should Read the Toyota Way,2019-11-08T22:39:29.000Z,2,0,https://zwischenzugs.com/2019/11/06/why-everyone-working-in-devops-should-read-the-toyota-way/
21487668,I can't remove Python 2 from my systems (yet),2019-11-08T22:37:24.000Z,2,0,https://github.com/sanxiyn/blog/blob/master/posts/2019-11-08.md
21487665,"Ahead of layoffs, WeWorkers demand compensation for lost equity",2019-11-08T22:37:09.000Z,2,0,https://gizmodo.com/swindled-weworkers-ask-for-dignity-1839719337
21487660,Scientists are trying to create non-hallucinogenic psychedelics,2019-11-08T22:36:49.000Z,5,0,https://www.vice.com/en_us/article/pa748k/psilocybin-for-depression-and-the-world-of-non-hallucinogenic-psychedelics
21487632,Quantum Machine Learning Hackathon,2019-11-08T22:33:31.000Z,1,0,https://qhack.ai/
21487631,Report: Chinese Government Assigning Han Men to Live and Sleep with Uighur Women,2019-11-08T22:33:30.000Z,16,4,https://www.nationalreview.com/news/chinese-government-assigning-han-men-to-live-and-sleep-with-uighur-women-whose-husbands-have-been-detained-report
21487609,Norman Myers Dies at 85; Sounded Early Alarm on Environment,2019-11-08T22:30:00.000Z,4,0,https://www.nytimes.com/2019/11/08/science/norman-myers-dead.html
21487602,"Green Card Backlog Unlikely to Get Senate Hearing, Durbin Says",2019-11-08T22:29:25.000Z,2,0,https://news.bloomberglaw.com/daily-labor-report/green-card-backlog-unlikely-to-get-senate-hearing-durbin-says
21487599,WeWork's Adam Neumann sued over $1.7bn package,2019-11-08T22:29:10.000Z,3,2,https://www.bbc.com/news/business-50351834
21487589,Starship Update,2019-11-08T22:27:54.000Z,4,0,https://www.youtube.com/watch?v=R46smYKbdQ4
21487588,How did America end up raising Generation Paranoia?,2019-11-08T22:27:49.000Z,7,0,https://www.washingtonpost.com/opinions/how-did-america-end-up-raising-generation-paranoia/2018/11/13/5d294ec8-e78b-11e8-b8dc-66cca409c180_story.html
21487560,Supreme Court statistics: Interactive visualizations,2019-11-08T22:24:51.000Z,2,0,https://harvardlawreview.org/supreme-court-statistics/
21487534,Facebook Will Start Asking for a Selfie to Verify Your Identity,2019-11-08T22:21:55.000Z,3,1,https://wersm.com/facebook-will-start-asking-for-a-selfie-to-verify-your-identity/
