objectID,title,created_at,points,num_comments,url
21491421,"Deep Learning for Programmers (GPU, CPU, Clojure) Book 0.12.0",2019-11-09T13:32:38.000Z,5,0,https://aiprobook.com/deep-learning-for-programmers?release=0.12.0&src=hn
21491413,Unofficial Nox port to Linux using decompiled code from playnox.xyz,2019-11-09T13:31:13.000Z,1,0,https://github.com/neuromancer/nox-decomp
21491408,Tim Cook’s Master Plan,2019-11-09T13:30:13.000Z,1,1,https://blog.ayjay.org/tim-cooks-master-plan/
21491394,Signal Play Fest,2019-11-09T13:27:26.000Z,1,0,https://pong.berkeley.edu/playfest/
21491385,How to change your relationship with stress,2019-11-09T13:25:26.000Z,1,0,https://www.dexterzhuang.com/blog/how-to-change-your-relationship-with-stress-for-good/
21491378,Show HN: Go Micro – A Go microservices development framework,2019-11-09T13:24:43.000Z,65,42,https://go.micro.mu
21491356,Climate Refugia,2019-11-09T13:20:03.000Z,1,1,https://craigmedred.news/2019/11/09/climate-refugia/
21491344,Gender similarities in the brain during mathematics development,2019-11-09T13:18:07.000Z,3,0,https://www.nature.com/articles/s41539-019-0057-x
21491343,Videos YouTube en mi cuenta,2019-11-09T13:18:06.000Z,1,0,https://engineering.fb.com/security/fizz/
21491334,Learn Python by Building Five Games – Full Course,2019-11-09T13:17:28.000Z,3,0,https://www.youtube.com/watch?v=XGf2GcyHPhc
21491324,Beyond ‘Punk Rock Git’ in Eleven Steps,2019-11-09T13:15:24.000Z,2,0,https://zwischenzugs.com/2018/05/14/beyond-punk-rock-git-in-eleven-steps/
21491300,DHH: Apple Card is sexist [twitter thread],2019-11-09T13:11:37.000Z,6,1,https://twitter.com/dhh/status/1192540900393705474
21491284,Joining a modern software development team,2019-11-09T13:07:59.000Z,2,1,https://www.programming-decoded.com/blog/joining-a-modern-software-development-team/
21491270,Law of Jante,2019-11-09T13:03:32.000Z,5,0,https://en.wikipedia.org/wiki/Law_of_Jante
21491267,What’s Wrong with the Economy?,2019-11-09T13:03:24.000Z,1,1,http://www.aeriagloris.com/Articles/whatswrongwiththeeconomy.htm
21491264,The Virtue of Monopoly: Why the Stock Market Stopped Working,2019-11-09T13:02:48.000Z,2,0,https://www.foreignaffairs.com/reviews/review-essay/2019-10-15/virtue-monopoly
21491257,State of Text Rendering (2010),2019-11-09T13:01:17.000Z,39,15,http://behdad.org/text/
21491251,Google Plans to Acquire a Trove of Health Data in Fitbit,2019-11-09T12:59:33.000Z,1,0,https://slate.com/technology/2019/11/google-plans-to-buy-fitbit-for-usd2-1-billion.html
21491250,Trip Autumn ISO C++ Standards Meeting (Belfast),2019-11-09T12:59:32.000Z,3,0,https://herbsutter.com/2019/11/09/trip-report-autumn-iso-c-standards-meeting-belfast/
21491248,Four Types of Money in Software,2019-11-09T12:59:24.000Z,2,0,https://www.roycehaynes.com/four-types-of-money-in-software.html
21491243,Photos: Dark beauty in the oil fields of old Southern California,2019-11-09T12:58:44.000Z,1,0,https://timeline.com/photos-dark-beauty-in-the-oil-fields-of-old-southern-california-f8aea365d38d
21491236,Exploring the Electron Framework for Our Windows App,2019-11-09T12:57:58.000Z,2,0,https://blog.dashlane.com/exploring-the-electron-framework-for-our-windows-app/
21491221,What an Economist+Political Scientist+Pyschologist+Programmer Looks Like,2019-11-09T12:55:25.000Z,1,1,https://en.wikipedia.org/wiki/Herbert_A._Simon
21491194,Nvidia unveils Nano-sized spin-down of high-end Jetson Xavier,2019-11-09T12:48:31.000Z,1,0,http://linuxgizmos.com/nvidia-unveils-nano-sized-spin-down-of-high-end-jetson-xavier/
21491170,"Implicit Association Test: Disillusioning Findings, Reasonable Explanations",2019-11-09T12:43:23.000Z,2,0,https://www.frontiersin.org/articles/10.3389/fpsyg.2019.02483/full
21491165,Excel drum machine found on YouTube,2019-11-09T12:42:13.000Z,10,1,https://youtube.com/watch?v=To2JIXGoYzA
21491159,We Should Let a Lottery Decide Our Government,2019-11-09T12:39:38.000Z,1,0,https://thewalrus.ca/why-we-should-let-a-lottery-decide-our-government/
21491155,California’s Board Diversity Tax,2019-11-09T12:38:47.000Z,1,1,https://www.wsj.com/articles/californias-board-diversity-tax-11573256678?mod=rsswn
21491154,WeWork Investor Presentation (2019) [pdf],2019-11-09T12:38:27.000Z,1,0,https://www.wework.com/newsroom/wp-content/uploads/2019/11/Investor-Presentation—October-2019.pdf
21491141,Grand Prix D'Horlogerie de Genève – Watch Prize List 2019,2019-11-09T12:34:26.000Z,1,0,https://www.gphg.org/horlogerie/en/prize-list-19
21491139,The Ultimate Guide to 5G,2019-11-09T12:34:13.000Z,1,0,https://mediautama.live/5g-internet-the-latest-revolution-in-the-mobile-communication-network/
21491128,Show HN: Coloured progress-bar for your Golang CLI,2019-11-09T12:31:33.000Z,21,1,https://github.com/alexellis/cli-progress-animation
21491124,Tempinbox.xyz – Temp Mail Service,2019-11-09T12:29:27.000Z,3,0,https://www.tempinbox.xyz
21491120,Fast Piratebay Proxy,2019-11-09T12:28:13.000Z,2,0,https://www.tpbay.win
21491093,A Japanese Ghost Town in a Canadian Forest,2019-11-09T12:22:26.000Z,2,0,https://www.atlasobscura.com/articles/japanese-immigrants-in-canada
21491084,Aaron Swartz Day and International Hackathon,2019-11-09T12:18:16.000Z,2,0,https://www.aaronswartzday.org/world-cities/
21491079,AMD FreeSync 2 HDR,2019-11-09T12:17:08.000Z,4,0,https://gpuopen.com/using-amd-freesync-2-hdr-color-spaces/
21491076,What dentistry was like before anaesthetic,2019-11-09T12:16:43.000Z,1,0,https://www.bbc.com/ideas/videos/what-dentistry-was-like-before-anaesthetic-ouch/p07rcy24
21491072,VEBA Appliance for Extending VCenter with OpenFaaS,2019-11-09T12:15:21.000Z,2,0,https://flings.vmware.com/vcenter-event-broker-appliance
21491062,WeWork's Adam Neumann sued over $1.7bn package,2019-11-09T12:14:04.000Z,5,1,https://www.bbc.com/news/business-50351834
21491057,Who owns your favorite privacy service?,2019-11-09T12:12:05.000Z,2,0,https://www.reddit.com/r/privacytoolsIO/comments/dpqipq/who_owns_your_favorite_privacy_service_what_if/
21491056,Most claims in software development are unjustified,2019-11-09T12:11:33.000Z,2,0,https://medium.com/@a.j.kaijanaho/most-claims-in-software-development-are-unjustified-f0640acc8389
21491054,Await-to-JS – Async await wrapper for Go-like error handling without try-catch,2019-11-09T12:11:26.000Z,1,0,https://github.com/scopsy/await-to-js
21491053,Show HN: Brightin.me Sends Handpicked News,2019-11-09T12:11:23.000Z,2,0,https://www.brightin.me/
21491045,2019-11 Belfast ISO C++ Committee Trip Report,2019-11-09T12:10:08.000Z,1,0,https://www.reddit.com/r/cpp/comments/dtuov8/201911_belfast_iso_c_committee_trip_report/
21491039,Facebook gave Tinder and other dating apps special access to user data,2019-11-09T12:07:44.000Z,2,0,https://mashable.com/article/facebook-tinder-user-data-access/
21491033,Parkinson's Law: Work expands to fill available time,2019-11-09T12:06:52.000Z,121,26,https://www.bbc.com/worklife/article/20191107-the-law-that-explains-why-you-cant-get-anything-done
21491022,MIT's AI Gives Robot the Ability to Feel Objects by Sight,2019-11-09T12:03:53.000Z,2,0,https://sparkonit.com/2019/06/18/mits-new-ai-gives-robot-the-ability-to-feel-objects-by-sight/
21491012,Go Stream Processing Library,2019-11-09T12:00:28.000Z,4,0,https://github.com/reugn/go-streams
21491007,"Restaurant food price, food specific rating&distance comparison with navigation",2019-11-09T11:59:06.000Z,1,0,https://play.google.com/store/apps/details?id=com.saawaytake.awaytake
21490985,A Prisoner Who Briefly Died Argues That He’s Served His Life Sentence,2019-11-09T11:54:00.000Z,96,89,https://www.nytimes.com/2019/11/08/us/prisoner-dies-life-sentence.html
21490981,One-Percenters Close to Surpassing Wealth of U.S. Middle Class,2019-11-09T11:53:32.000Z,177,272,https://www.bloomberg.com/news/articles/2019-11-09/one-percenters-close-to-surpassing-wealth-of-u-s-middle-class
21490970,"Ilford Unveils Ortho 35mm and 120 Film, 5th-Gen Multigrade RC Paper",2019-11-09T11:51:17.000Z,2,1,https://petapixel.com/2019/10/24/ilford-unveils-ortho-35mm-and-120-film-5th-gen-multigrade-rc-paper/
21490949,Airships could return to our crowded skies,2019-11-09T11:44:09.000Z,80,65,https://www.bbc.com/future/article/20191107-how-airships-could-return-to-our-crowded-skies
21490935,“The complexity threat to security” at NATOs CYCON,2019-11-09T11:40:34.000Z,1,1,https://www.err.ee/836236/video-google-0-projekti-tarkvarainseneri-ettekanne-cyconil
21490921,Optimal Bucket,2019-11-09T11:36:55.000Z,1,0,https://thuum7.blogspot.com/2019/11/most-efficient-bucket.html
21490916,The Measure of Intelligence,2019-11-09T11:35:23.000Z,2,0,https://arxiv.org/abs/1911.01547
21490913,"Mercury putting on rare show Monday, parading across the sun",2019-11-09T11:34:54.000Z,1,0,https://phys.org/news/2019-11-mercury-rare-monday-parading-sun.html
21490905,A Simple Dutch Cure for Stress,2019-11-09T11:33:13.000Z,76,63,http://nautil.us/blog/the-simple-dutch-cure-for-stress
21490889,How an Optimizing Compiler Works,2019-11-09T11:29:38.000Z,6,0,http://www.lihaoyi.com/post/HowanOptimizingCompilerWorks.html
21490862,Germany’s Online Crackdowns Inspire the World’s Dictators,2019-11-09T11:20:49.000Z,2,0,https://foreignpolicy.com/2019/11/06/germany-online-crackdowns-inspired-the-worlds-dictators-russia-venezuela-india/
21490859,Why did Amazon spend $1.5m in Seattle's local elections?,2019-11-09T11:19:23.000Z,4,3,https://www.theguardian.com/commentisfree/2019/nov/09/us-democracy-politics-wealth-plutocracy-money
21490855,"Artificial Intelligence offers solutions for agriculture, health and education",2019-11-09T11:19:07.000Z,1,0,https://www.iafrikan.com/2019/11/09/artificial-intelligence-offers-solutions-for-agriculture-health-and-education-and-global-economic-gains-however-there-are-challenges/
21490854,Instacart Strike Thread,2019-11-09T11:19:06.000Z,2,0,https://twitter.com/sashaperigo/status/1192973276470865921
21490850,My name causes an issue with any booking,2019-11-09T11:17:31.000Z,698,303,https://travel.stackexchange.com/questions/149323/my-name-causes-an-issue-with-any-booking-names-end-with-mr-and-mrs
21490849,LineageOS Android Distribution,2019-11-09T11:17:29.000Z,182,92,https://lineageos.org/
21490838,"By Studying Mouth Bacteria, Scientists Hope to Learn the Secrets of Microbiomes",2019-11-09T11:14:21.000Z,2,0,https://www.smithsonianmag.com/science-nature/studying-mouth-bacteria-scientists-hope-learn-secrets-microbiomes-180973509/
21490829,Is China Stealing American Jobs and Wealth?,2019-11-09T11:12:04.000Z,5,0,https://hbr.org/2019/11/is-china-actually-stealing-american-jobs-and-wealth
21490827,The Chinese suicides prevented by AI from afar,2019-11-09T11:10:43.000Z,2,0,https://www.bbc.com/news/technology-50314819
21490812,"Murderer 'Dies,' Is Resuscitated, Then Says He Completed His Life Sentence",2019-11-09T11:07:09.000Z,2,0,https://www.npr.org/2019/11/08/777574406/murderer-dies-is-resuscitated-then-says-he-completed-his-life-sentence
21490805,The dating app Instagram should build – because Apple just banned ours,2019-11-09T11:04:26.000Z,2,0,https://medium.com/@lem101/the-dating-app-instagram-should-build-because-apple-banned-ours-52635808405a
21490800,CGI version of James Dean gets cast in new movie and sparks backlash,2019-11-09T11:03:32.000Z,1,0,https://www.latimes.com/entertainment-arts/movies/story/2019-11-07/james-dean-cgi-casting
21490799,Show HN: Open statistics for remote jobs newsletter I'm building,2019-11-09T11:03:20.000Z,2,0,https://remoteweekly.cc/open
21490796,Security Analysis of a Cheap Chinese IoT WiFi Camera,2019-11-09T11:02:44.000Z,12,5,https://eriknl.github.io/reverse-engineering/2017/09/07/WiFi-camera.html
21490795,17th century warships linked to Sweden's historic Vasa found,2019-11-09T11:02:36.000Z,2,0,https://www.theguardian.com/world/2019/nov/08/17th-century-warships-linked-to-swedens-historic-vasa-found
21490793,"As Disasters Worsen, Cities and Researchers Eye Social Resilience",2019-11-09T11:01:51.000Z,29,12,https://www.citylab.com/environment/2019/11/mental-health-support-natural-disaster-trauma-ptsd-anxiety/601522/
21490784,"Forget Paris: Go to Winnipeg, author who has visited more than 110 countries",2019-11-09T10:59:36.000Z,1,0,https://www.cbc.ca/radio/thecurrent/forget-paris-go-to-winnipeg-says-author-who-has-visited-more-than-110-countries-1.5353195
21490782,High-Ranking Dog Provides Key Training for Military's Medical Students,2019-11-09T10:57:22.000Z,2,0,https://www.npr.org/sections/health-shots/2019/11/08/777049581/high-ranking-dog-provides-key-training-for-militarys-medical-students
21490779,"As Delhi Chokes on Smog, India's Health Minister Advises: Eat More Carrots",2019-11-09T10:57:04.000Z,2,0,https://www.npr.org/sections/goatsandsoda/2019/11/08/775487863/as-delhi-chokes-on-smog-indias-health-minister-advises-eat-more-carrots
21490767,OpenAI publishes text-generation tool that can write believable fake news,2019-11-09T10:54:10.000Z,1,0,https://www.techspot.com/news/82686-openai-publishes-text-generation-tool-can-write-believable.html
21490766,OpenAI's Text Generator Is More Funny Than Dangerous,2019-11-09T10:53:58.000Z,1,0,https://gizmodo.com/turns-out-elon-musk-backed-openais-text-generator-is-mo-1839705114
21490765,Great Impractical Ideas in Computer Science: PowerPoint Programming,2019-11-09T10:53:54.000Z,3,0,https://www.youtube.com/watch?v=_3loq22TxSc
21490762,An old-school shell hack on a line printer,2019-11-09T10:52:53.000Z,1,0,https://drewdevault.com/2019/10/30/Line-printer-shell-hack.html
21490761,CDC reports 'breakthrough' over vaping lung illnesses as cases topk,2019-11-09T10:52:48.000Z,1,0,https://www.theguardian.com/society/2019/nov/08/cdc-vaping-lung-injury-breakthrough-vitamin-e-acetate
21490758,"Who Owns HIV-Prevention Drugs? The Taxpayers, U.S. Says",2019-11-09T10:51:49.000Z,1,0,https://www.nytimes.com/2019/11/08/health/hiv-prevention-truvada-patents.html
21490746,Ask HN: Did you ever send a scan of your id via mail?,2019-11-09T10:47:35.000Z,1,1,
21490740,What Mac OS’s case-insensitive filenames teaches us,2019-11-09T10:44:59.000Z,3,9,https://medium.com/@paulbjensen/what-mac-oss-case-insensitive-filenames-teaches-us-cd8feee7b0b3
21490731,Let's Create a Simple Load Balancer with Go,2019-11-09T10:42:43.000Z,233,44,https://kasvith.github.io/posts/lets-create-a-simple-lb-go/
21490729,Getting Arbitrary Code Execution from Fopen's 2nd Argument,2019-11-09T10:41:28.000Z,2,0,https://hugeh0ge.github.io/2019/11/04/Getting-Arbitrary-Code-Execution-from-fopen-s-2nd-Argument/
21490714,It’s Not Enough to Be Right – You Also Have to Be Kind,2019-11-09T10:34:14.000Z,447,260,https://forge.medium.com/its-not-enough-to-be-right-you-also-have-to-be-kind-b8814111fe1
21490705,How to Ease into a Work-from-Home Benefit,2019-11-09T10:32:27.000Z,1,0,https://www.inc.com/tanya-hall/how-to-ease-into-a-work-from-home-benefit.html
21490701,SPV Proofs Explained,2019-11-09T10:31:31.000Z,2,0,https://medium.com/coinmonks/spv-proofs-explained-f38f8bb8f580
21490699,Estonia has a new way to stop speeding motorists,2019-11-09T10:31:09.000Z,161,141,https://www.economist.com/europe/2019/11/07/estonia-has-a-new-way-to-stop-speeding-motorists
21490697,"The U.S. military, algorithmic warfare, and big tech",2019-11-09T10:30:49.000Z,2,0,https://venturebeat.com/2019/11/08/the-u-s-military-algorithmic-warfare-and-big-tech/
21490694,"Don't Learn More, Learn Smarter. A Quick Guide to Agile Learning",2019-11-09T10:30:01.000Z,2,0,https://www.entrepreneur.com/article/341618
21490688,The American Dream Is Alive in China,2019-11-09T10:28:58.000Z,4,1,http://palladiummag.com/2019/10/11/the-american-dream-is-alive-in-china/?share=1
21490674,YouTube suspends Google accounts of Markiplier's viewers for minor emote spam,2019-11-09T10:23:16.000Z,141,75,https://www.reddit.com/r/videos/comments/dtr6gi/youtube_suspends_google_accounts_of_markipliers/
21490669,Stunning Desktop Linux OS Deepin v20 Has a Release Date,2019-11-09T10:21:56.000Z,5,0,https://www.forbes.com/sites/jasonevangelho/2019/11/07/stunning-desktop-linux-distro-deepin-v20-has-a-release-date/
21490667,A 19th-Century Vision of the Year 2000,2019-11-09T10:21:22.000Z,2,1,https://publicdomainreview.org/collections/france-in-the-year-2000-1899-1910/
21490654,I got my money back from a scammer by contacting his mom on Facebook (2016),2019-11-09T10:15:16.000Z,451,147,https://blog.haschek.at/2016/how-a-scammer-stole-500-dollars-from-me
21490640,Tech Companies Warn U.S. Against Harmful Copyright Laws Worldwide,2019-11-09T10:08:36.000Z,1,0,https://torrentfreak.com/tech-companies-warn-u-s-against-harmful-copyright-laws-worldwide-191109/
21490594,Notes on Type Layouts and ABIs in Rust,2019-11-09T09:49:59.000Z,2,0,https://gankra.github.io/blah/rust-layouts-and-abis/
21490575,C++Cast: CRTP and Israel Joining the C++ ISO,2019-11-09T09:46:05.000Z,1,0,https://cppcast.com/inbal-levi/
21490562,Developers: It's super easy to bypass Android's hidden API restrictions,2019-11-09T09:41:35.000Z,2,0,https://www.xda-developers.com/android-development-bypass-hidden-api-restrictions/
21490490,DEF CON 26 – M010ch – Please Do Not Duplicate Attacking the Knox Box,2019-11-09T09:14:29.000Z,2,0,https://www.youtube.com/watch?v=f4rPDF993qs
21490488,"VC, Kamran Elahian, on building and investing in tech unicorns",2019-11-09T09:13:15.000Z,1,0,https://soundcloud.com/the-tefo-mohapi-show/kamran-elahian
21490483,Home of Tech,2019-11-09T09:11:21.000Z,1,0,https://meghub.blogspot.com/
21490480,How to Burn a Bootable ISO to Make a Bootable CD/DVD(Free ISO Burner),2019-11-09T09:10:35.000Z,1,0,https://meghub.blogspot.com/2019/09/burn-bootable-iso-to-make.htmlhttps://meghub.blogspot.com/2019/09/burn-bootable-iso-to-make.html
21490473,Show HN: Full-text search for coding jobs,2019-11-09T09:07:51.000Z,4,1,https://github.com/santinic/hackwage/
21490468,99 Percent of All Cryptocurrencies Will Go to Zero in the Future,2019-11-09T09:05:39.000Z,2,0,https://medium.com/@ssaurel/99-percent-of-all-cryptocurrencies-will-go-to-zero-in-the-future-751f2a4217a
21490467,"Advice for introverts: Fake it, and you'll be happier",2019-11-09T09:04:51.000Z,3,0,https://www.sciencedaily.com/releases/2019/09/190917100449.htm
21490463,From Zero to Kubernetes Dashboard Within Minutes with K3sup and Kontena Lens,2019-11-09T09:02:03.000Z,4,0,https://medium.com/@laurinevala/from-zero-to-kubernetes-dashboard-within-minutes-with-k3sup-and-kontena-lens-84f881400b10
21490432,Have any released game used Amazon Lumberyard?,2019-11-09T08:52:27.000Z,1,0,https://old.reddit.com/r/gamedev/comments/axqq94/amazons_lumberyard_engine_launched_3_years_ago/
21490422,Bell Labs Demonstrates Ways of Using Light to Transmit Sound Waves (1978),2019-11-09T08:47:57.000Z,1,0,https://www.youtube.com/watch?v=gf2J3HTYUHE
21490417,A.I. Just Cracked 'Three-Body Problem' in Under a Second,2019-11-09T08:46:28.000Z,2,0,https://www.livescience.com/ai-solves-three-body-problem-fast.html
21490408,Show HN: k3sup – get Kubernetes and helm apps in,2019-11-09T08:44:01.000Z,80,10,https://k3sup.dev
21490402,Autoscaling DigitalOcean Block Storage,2019-11-09T08:41:55.000Z,2,0,https://github.com/lukechilds/autoscale-do-block-storage
21490364,Dynamically Adjustable Key-Value Store by Combining LSM and COW B+ Tree [pdf],2019-11-09T08:30:10.000Z,4,0,https://greensky00.github.io/pdf/jungle_hotstorage19.pdf
21490361,A tiny pharmacy is identifying big problems with common drugs,2019-11-09T08:28:52.000Z,21,2,https://www.washingtonpost.com/science/a-tiny-pharmacy-is-identifying-big-problems-with-common-drugs-including-zantac/2019/11/08/6dd009ca-eb76-11e9-9c6d-436a0df4f31d_story.html
21490347,People Working in DevOps Should Read the Toyota Way,2019-11-09T08:24:40.000Z,77,34,https://zwischenzugs.com/2019/11/06/why-everyone-working-in-devops-should-read-the-toyota-way/
21490344,Gloves that can translate sign language into speech/text,2019-11-09T08:23:28.000Z,1,0,https://www.reddit.com/r/interestingasfuck/comments/dtmxy8/gloves_that_can_translate_sign_language_into/
21490341,Blockers bring down content quality by depriving content creators of incentive,2019-11-09T08:22:04.000Z,2,2,https://freelancemag.blogspot.com/2019/11/unpopular-opinion-ad-blockers-bring.html
21490324,San Francisco Was Preparing for a Flood of IPO Cash That Never Came,2019-11-09T08:14:45.000Z,3,0,https://www.bloomberg.com/news/articles/2019-11-08/san-francisco-was-preparing-for-a-flood-of-ipo-cash-that-never-came
21490321,The Main Programming Language,2019-11-09T08:13:01.000Z,4,0,https://github.com/havbon/TheMainLanguage
21490305,Building a CRUD App with Datomic Cloud Ions,2019-11-09T08:09:17.000Z,3,0,https://jacobobryant.com/post/2019/ion/
21490288,Embraer E175 Loses Control over Atlanta,2019-11-09T08:02:28.000Z,1,0,https://samchui.com/2019/11/08/embraer-e175-loses-control-over-atlanta
21490283,tree-seq,2019-11-09T08:01:39.000Z,1,0,https://clojuredocs.org/clojure.core/tree-seq
21490279,Linting Datalog with Clj-Kondo,2019-11-09T08:00:12.000Z,1,0,https://lambdaforge.io/2019/11/08/clj-kondo-datalog-support.html
21490275,Robocall on the Fly with Python – ___,2019-11-09T07:59:16.000Z,3,0,https://github.com/rootVIII/robocall101
21490264,Naïve Bayes for Machine Learning – From Zero to Hero,2019-11-09T07:55:13.000Z,4,0,https://blog.floydhub.com/naive-bayes-for-machine-learning/
21490257,Have money back guarantees helped your sales?,2019-11-09T07:52:10.000Z,6,0,https://capitalandgrowth.org/questions/1541/have-money-back-guarantees-helped-your-sales.html
21490221,Russia Is Building One of the World's Largest Facial Recognition Networks,2019-11-09T07:40:25.000Z,1,0,https://codastory.com/authoritarian-tech/russia-facial-recognition-networks/
21490211,Linux Smartphone PinePhone Will Be Available to Pre-Order Next Week,2019-11-09T07:39:04.000Z,9,1,https://itsfoss.com/pinephone/
21490199,Who is the real Dice Man? The elusive writer behind a cult novel,2019-11-09T07:35:56.000Z,79,41,https://www.theguardian.com/news/2019/nov/07/the-dice-man-elusive-author-luke-rhinehart-george-cockroft-emmanuel-carrere
21490190,An African Child’s Dream Comes True – Sho Madjozi,2019-11-09T07:33:30.000Z,1,0,https://tedsf.org/an-african-childs-dream-comes-true-sho-madjozi/
21490151,Curl to shell isn't so bad,2019-11-09T07:22:14.000Z,254,176,https://arp242.net/curl-to-sh.html
21490132,Post-Empirical Science?,2019-11-09T07:15:55.000Z,28,35,https://aeon.co/essays/post-empirical-science-is-an-oxymoron-and-it-is-dangerous
21490125,How big tech is dragging us towards the next financial crash,2019-11-09T07:14:00.000Z,5,0,https://www.theguardian.com/business/2019/nov/08/how-big-tech-is-dragging-us-towards-the-next-financial-crash
21490118,Should I Pursue a PhD?,2019-11-09T07:11:27.000Z,5,3,
21490117,The Wright Brothers: Pioneers of Patent Trolling,2019-11-09T07:10:57.000Z,109,42,https://time.com/4143574/wright-brothers-patent-trolling/
21490114,Is Puppeteer-Firefox Ready?,2019-11-09T07:10:09.000Z,1,0,https://aslushnikov.github.io/ispuppeteerfirefoxready/
21490107,Send and accept Lightning payments using Bitcoin or Ether–no accounts needed,2019-11-09T07:07:59.000Z,1,0,https://twitter.com/radar_ion/status/1191783806077825024
21490104,GrubSnub and What’s Wrong with Gig Economy,2019-11-09T07:06:33.000Z,2,0,https://om.co/2019/11/02/whats-really-wrong-with-gig-economy/
21490094,Uncontacted Peoples,2019-11-09T07:03:26.000Z,2,0,https://en.wikipedia.org/wiki/Uncontacted_peoples
21490084,Widescreen Laptops Are Dumb(2018),2019-11-09T07:00:26.000Z,2,0,https://www.theverge.com/circuitbreaker/2018/4/19/17027286/laptop-widescreen-aspect-ratio
21490082,“America Isn’t Easy –.” – Mark Zuckerberg,2019-11-09T06:59:11.000Z,1,0,https://www.facebook.com/4/posts/10110290602526841?d=n&sfns=mo
21490081,Deep learning has a size problem,2019-11-09T06:59:10.000Z,3,1,https://heartbeat.fritz.ai/deep-learning-has-a-size-problem-ea601304cd8
21490058,Writing Better Marble Tests for Redux Observable and TypeScript,2019-11-09T06:53:39.000Z,1,0,https://medium.com/@dawchihliou/better-marble-test-70c7676a1e2
21490051,I made a question and answer community for anyone going abroad,2019-11-09T06:51:10.000Z,2,1,http://journeyfoxx.com
21489950,The world’s first Gattaca baby tests are finally here,2019-11-09T06:14:42.000Z,1,0,https://www.technologyreview.com/s/614690/polygenic-score-ivf-embryo-dna-tests-genomic-prediction-gattaca/
21489938,Vulnerability in Ring Doorbells Left the Door Open for Hackers to Open the Door,2019-11-09T06:11:26.000Z,1,0,https://gizmodo.com/vulnerability-in-ring-doorbells-left-the-door-open-for-1839697255/
21489936,Judge Says Police Can Search Company's Entire DNA Database,2019-11-09T06:11:10.000Z,10,0,https://www.huffingtonpost.ca/entry/police-search-dna-database_n_5dc1dc4ee4b08b735d616096
21489922,Bugcrowd Paid over $500K in Bug Bounties in One Week,2019-11-09T06:07:16.000Z,2,0,https://www.bleepingcomputer.com/news/security/bugcrowd-paid-over-500k-in-bug-bounties-in-one-week/
21489903,First intercontinental bomb attack in history,2019-11-09T05:59:24.000Z,1,0,https://medium.com/lessons-from-history/first-intercontinental-bomb-drop-happened-75-years-ago-this-week-5afad9464dd6
21489881,Stellar Sonata,2019-11-09T05:51:30.000Z,65,7,https://en.wikipedia.org/wiki/Stellar_Sonata
21489877,Scientist: A Ruby library for carefully refactoring critical paths,2019-11-09T05:49:22.000Z,9,0,https://github.com/github/scientist
21489867,Be Lazy,2019-11-09T05:46:11.000Z,11,1,https://dcgross.com/be-lazy/
21489863,Apple will fix macOS flaw exposing portions of encrypted emails,2019-11-09T05:44:30.000Z,1,0,https://www.engadget.com/2019/11/08/apple-will-fix-macos-email-exposure-flaw/
21489801,Brian Beckman: Don't Fear the Monad,2019-11-09T05:25:18.000Z,4,3,https://m.youtube.com/watch?v=ZhuHCtR3xq8
21489798,"As WeWork Tries to Repair Its Business, There’s a Lot of Space to Fill",2019-11-09T05:24:14.000Z,3,0,https://www.bloomberg.com/news/articles/2019-11-08/wework-says-it-ll-divest-businesses-and-focus-on-co-working
